,Title,Rank,Description,Director,Actors,Year,Runtime (Minutes),Rating,Votes,Revenue (Millions),Metascore,Genre_is_Drama,split
0,Mine,161,"After a failed assassination attempt, a soldier finds himself stranded in the desert. Exposed to the elements, he must survive the dangers of the desert and battle the psychological and physical tolls of the treacherous conditions.",Fabio Guaglione,"Armie Hammer, Annabelle Wallis,Tom Cullen, Clint Dyer",2016,106,6.0,5926,,40.0,False,-0.3870062021070747
1,Nightcrawler,171,"When Louis Bloom, a con man desperate for work, muscles into the world of L.A. crime journalism, he blurs the line between observer and participant to become the star of his own story.",Dan Gilroy,"Jake Gyllenhaal, Rene Russo, Bill Paxton, Riz Ahmed",2014,118,7.9,332476,32.28,76.0,True,0.0924500277877872
2,London Has Fallen,425,"In London for the Prime Minister's funeral, Mike Banning discovers a plot to assassinate all the attending world leaders.",Babak Najafi,"Gerard Butler, Aaron Eckhart, Morgan Freeman,Angela Bassett",2016,99,5.9,100702,62.4,28.0,True,0.9936010814763777
3,Sherlock Holmes: A Game of Shadows,466,"Sherlock Holmes and his sidekick Dr. Watson join forces to outwit and bring down their fiercest adversary, Professor Moriarty.",Guy Ritchie,"Robert Downey Jr., Jude Law, Jared Harris, Rachel McAdams",2011,129,7.5,357436,186.83,48.0,False,-0.7261793697517095
4,Mechanic: Resurrection,415,"Arthur Bishop thought he had put his murderous past behind him, until his most formidable foe kidnaps the love of his life. Now he is forced to travel the globe to complete three impossible assassinations, and do what he does best: make them look like accidents.",Dennis Gansel,"Jason Statham, Jessica Alba, Tommy Lee Jones,Michelle Yeoh",2016,98,5.6,48161,21.2,38.0,False,-0.10454328765100471
6,In Bruges,753,"Guilt-stricken after a job gone wrong, hitman Ray and his partner await orders from their ruthless boss in Bruges, Belgium, the last place in the world Ray wants to be.",Martin McDonagh,"Colin Farrell, Brendan Gleeson, Ciarán Hinds,Elizabeth Berrington",2008,107,7.9,322536,7.76,67.0,True,-0.7236826214851525
7,127 Hours,818,"An adventurous mountain climber becomes trapped under a boulder while canyoneering alone near Moab, Utah and resorts to desperate measures in order to survive.",Danny Boyle,"James Franco, Amber Tamblyn, Kate Mara, Sean Bott",2010,94,7.6,294010,18.33,82.0,True,0.6077206704013213
8,Silence,56,"In the 17th century, two Portuguese Jesuit priests travel to Japan in an attempt to locate their mentor, who is rumored to have committed apostasy, and to propagate Catholicism.",Martin Scorsese,"Andrew Garfield, Adam Driver, Liam Neeson,Tadanobu Asano",2016,161,7.3,49190,7.08,79.0,True,0.32213726044190333
9,21,851,"""21"" is the fact-based story about six MIT students who were trained to become experts in card counting and subsequently took Vegas casinos for millions in winnings.",Robert Luketic,"Jim Sturgess, Kate Bosworth, Kevin Spacey, Aaron Yoo",2008,123,6.8,198395,81.16,48.0,True,0.6548059344339133
11,Old Boy,214,"Obsessed with vengeance, a man sets out to find out why he was kidnapped and locked into solitary confinement for twenty years without reason.",Spike Lee,"Josh Brolin, Elizabeth Olsen, Samuel L. Jackson, Sharlto Copley",2013,104,5.8,54679,,49.0,True,0.8713491156071795
12,Wakefield,69,A man's nervous breakdown causes him to leave his wife and live in his attic for several months.,Robin Swicord,"Bryan Cranston, Jennifer Garner, Beverly D'Angelo,Jason O'Mara",2016,106,7.5,291,0.01,61.0,True,1.095920123861395
13,Sin City: A Dame to Kill For,427,Some of Sin City's most hard-boiled citizens cross paths with a few of its more reviled inhabitants.,Frank Miller,"Mickey Rourke, Jessica Alba, Josh Brolin, Joseph Gordon-Levitt",2014,102,6.5,122185,13.75,46.0,False,-1.1715576925712066
15,Silver Linings Playbook,337,"After a stint in a mental institution, former teacher Pat Solitano moves back in with his parents and tries to reconcile with his ex-wife. Things get more challenging when Pat meets Tiffany, a mysterious girl with problems of her own.",David O. Russell,"Bradley Cooper, Jennifer Lawrence, Robert De Niro, Jacki Weaver",2012,122,7.8,564364,132.09,81.0,True,0.06553500465031332
16,Nocturnal Animals,32,"A wealthy art gallery owner is haunted by her ex-husband's novel, a violent thriller she interprets as a symbolic revenge tale.",Tom Ford,"Amy Adams, Jake Gyllenhaal, Michael Shannon, Aaron Taylor-Johnson",2016,116,7.5,126030,10.64,67.0,True,-0.027326146545694815
17,Allied,72,"In 1942, a Canadian intelligence officer in North Africa encounters a female French Resistance fighter on a deadly mission behind enemy lines. When they reunite in London, their relationship is tested by the pressures of war.",Robert Zemeckis,"Brad Pitt, Marion Cotillard, Jared Harris, Vincent Ebrahim",2016,124,7.1,78079,40.07,60.0,True,1.5334093306341534
18,Midnight in Paris,350,"While on a trip to Paris with his fiancée's family, a nostalgic screenwriter finds himself mysteriously going back to the 1920s everyday at midnight.",Woody Allen,"Owen Wilson, Rachel McAdams, Kathy Bates, Kurt Fuller",2011,94,7.7,320323,56.82,81.0,False,-1.4380810337486074
19,The Curious Case of Benjamin Button,426,"Tells the story of Benjamin Button, a man who starts aging backwards with bizarre consequences.",David Fincher,"Brad Pitt, Cate Blanchett, Tilda Swinton, Julia Ormond",2008,166,7.8,485075,127.49,70.0,True,1.316603352474512
20,No Escape,924,"In their new overseas home, an American family soon finds themselves caught in the middle of a coup, and they frantically look for a safe escape from an environment where foreigners are being immediately executed.",John Erick Dowdle,"Lake Bell, Pierce Brosnan, Owen Wilson,Chatchawai Kamonsakpitak",2015,103,6.8,57921,27.29,38.0,False,0.0942747751671063
21,Pandorum,453,A pair of crew members aboard a spaceship wake up with no knowledge of their mission or their identities.,Christian Alvart,"Dennis Quaid, Ben Foster, Cam Gigandet, Antje Traue",2009,108,6.8,126656,10.33,28.0,False,0.8101734957503852
23,Elysium,527,"In the year 2154, the very wealthy live on a man-made space station while the rest of the population resides on a ruined Earth. A man takes on a mission that could bring equality to the polarized worlds.",Neill Blomkamp,"Matt Damon, Jodie Foster, Sharlto Copley, Alice Braga",2013,109,6.6,358932,,,True,-0.11903428612113999
24,Super,938,"After his wife falls under the influence of a drug dealer, an everyday guy transforms himself into Crimson Bolt, a superhero with the best intentions, but lacking in heroic skills.",James Gunn,"Rainn Wilson, Ellen Page, Liv Tyler, Kevin Bacon",2010,96,6.8,64535,0.32,50.0,True,-0.12433380772324065
25,Exposed,839,A police detective investigates the truth behind his partner's death. The mysterious case reveals disturbing police corruption and a dangerous secret involving an unlikely young woman.,Gee Malik Linton,"Ana de Armas, Keanu Reeves, Christopher McDonald, Mira Sorvino",2016,102,4.2,8409,,23.0,True,1.7364601639166173
26,The Walk,968,"In 1974, high-wire artist Philippe Petit recruits a team of people to help him realize his dream: to walk the immense void between the World Trade Center towers.",Robert Zemeckis,"Joseph Gordon-Levitt, Charlotte Le Bon,Guillaume Baillargeon, Émilie Leclerc",2015,123,7.3,92378,10.14,,False,0.9503504566650922
27,Divergent,122,"In a world divided by factions based on virtues, Tris learns she's Divergent and won't fit in. When she discovers a plot to destroy Divergents, Tris and the mysterious Four must find out what makes Divergents dangerous before it's too late.",Neil Burger,"Shailene Woodley, Theo James, Kate Winslet, Jai Courtney",2014,139,6.7,362093,150.83,48.0,False,0.5449348377325094
28,The Girl with All the Gifts,210,A scientist and a teacher living in a dystopian future embark on a journey of survival with a special young girl named Melanie.,Colm McCarthy,"Gemma Arterton, Glenn Close, Dominique Tipper,Paddy Considine",2016,111,6.7,23713,,67.0,True,-0.9623570939796584
29,Enchanted,572,"A young maiden in a land called Andalasia, who is prepared to be wed, is sent away to New York City by an evil queen, where she falls in love with a lawyer.",Kevin Lima,"Amy Adams, Susan Sarandon, James Marsden, Patrick Dempsey",2007,107,7.1,150353,127.71,75.0,False,0.6067644501793611
31,Horrible Bosses,608,Three friends conspire to murder their awful bosses when they realize they are standing in the way of their happiness.,Seth Gordon,"Jason Bateman, Charlie Day, Jason Sudeikis, Steve Wiebe",2011,98,6.9,368556,117.53,57.0,False,-0.3385858678039663
32,The Green Inferno,528,"A group of student activists travels to the Amazon to save the rain forest and soon discover that they are not alone, and that no good deed goes unpunished.",Eli Roth,"Lorenza Izzo, Ariel Levy, Aaron Burns, Kirby Bliss Blanton",2013,100,5.4,26461,7.19,38.0,False,0.33373663785859276
34,The Amazing Spider-Man,369,"After Peter Parker is bitten by a genetically altered spider, he gains newfound, spider-like powers and ventures out to solve the mystery of his parent's mysterious death.",Marc Webb,"Andrew Garfield, Emma Stone, Rhys Ifans, Irrfan Khan",2012,136,7.0,474320,262.03,66.0,False,-0.6362164134804043
36,Slither,909,"A small town is taken over by an alien plague, turning residents into zombies and all forms of mutant monsters.",James Gunn,"Nathan Fillion, Elizabeth Banks, Michael Rooker, Don Thompson",2006,95,6.5,64351,7.77,69.0,False,1.2011381184849494
37,She's Out of My League,305,"An average Joe meets the perfect woman, but his lack of confidence and the influence of his friends and family begin to pick away at the relationship.",Jim Field Smith,"Jay Baruchel, Alice Eve, T.J. Miller, Mike Vogel",2010,104,6.4,105619,31.58,46.0,False,-1.8835816809982602
40,Friends with Benefits,727,"A young man and woman decide to take their friendship to the next level without becoming a couple, but soon discover that adding sex only leads to complications.",Will Gluck,"Mila Kunis, Justin Timberlake, Patricia Clarkson, Jenna Elfman",2011,109,6.6,286543,55.8,63.0,False,0.11318603486120456
42,Birdman or (The Unexpected Virtue of Ignorance),261,"Illustrated upon the progress of his latest Broadway play, a former popular actor's struggle to cope with his current life as a wasted actor is shown.",Alejandro González Iñárritu,"Michael Keaton, Zach Galifianakis,Edward Norton, Andrea Riseborough",2014,119,7.8,440299,42.34,88.0,True,-0.0014064148555291516
43,Wild,722,"A chronicle of one woman's 1,100-mile solo hike undertaken as a way to recover from a recent personal tragedy.",Jean-Marc Vallée,"Reese Witherspoon, Laura Dern, Gaby Hoffmann,Michiel Huisman",2014,115,7.1,95553,37.88,76.0,True,-0.3637762488043658
44,"Hello, My Name Is Doris",907,A self-help seminar inspires a sixty-something woman to romantically pursue her younger co-worker.,Michael Showalter,"Sally Field, Max Greenfield, Tyne Daly, Wendi McLendon-Covey",2015,95,6.7,12361,14.44,63.0,True,0.3137554195573121
45,Sing,4,"In a city of humanoid animals, a hustling theater impresario's attempt to save his theater with a singing competition becomes grander than he anticipates even as its finalists' find that their lives will never be the same.",Christophe Lourdelet,"Matthew McConaughey,Reese Witherspoon, Seth MacFarlane, Scarlett Johansson",2016,108,7.2,60545,270.32,59.0,False,0.22567625213137588
46,Pet,478,"A psychological thriller about a man who bumps into an old crush and subsequently becomes obsessed with her, leading him to hold her captive underneath the animal shelter where he works. ... See full summary »",Carles Torrens,"Dominic Monaghan, Ksenia Solo, Jennette McCurdy,Da'Vone McDonald",2016,94,5.7,8404,,48.0,False,-0.4902004110709246
47,Warm Bodies,877,"After a highly unusual zombie saves a still-living girl from an attack, the two form a relationship that sets in motion events that might transform the entire lifeless world.",Jonathan Levine,"Nicholas Hoult, Teresa Palmer, John Malkovich,Analeigh Tipton",2013,98,6.9,193579,66.36,59.0,False,-0.6641228311661691
48,Nymphomaniac: Vol. II,721,"The continuation of Joe's sexually dictated life delves into the darker aspects of her adulthood, obsessions and what led to her being in Seligman's care.",Lars von Trier,"Charlotte Gainsbourg, Stellan Skarsgård, Willem Dafoe, Jamie Bell",2013,123,6.7,65824,0.33,60.0,True,1.1216737080314556
49,A Cure for Wellness,202,"An ambitious young executive is sent to retrieve his company's CEO from an idyllic but mysterious ""wellness center"" at a remote location in the Swiss Alps, but soon suspects that the spa's treatments are not what they seem.",Gore Verbinski,"Dane DeHaan, Jason Isaacs, Mia Goth, Ivo Nandi",2016,146,6.5,12193,8.1,47.0,True,2.072085139958019
50,X: First Class,206,"In 1962, the United States government enlists the help of Mutants with superhuman abilities to stop a malicious dictator who is determined to start World War III.",Matthew Vaughn,"James McAvoy, Michael Fassbender, Jennifer Lawrence, Kevin Bacon",2011,132,7.8,550011,146.41,65.0,False,-1.3922542626614711
51,Satanic,270,"Four friends on their way to Coachella stop off in Los Angeles to tour true-crime occult sites, only to encounter a mysterious young runaway who puts them on a terrifying path to ultimate horror.",Jeffrey G. Hunt,"Sarah Hyland, Steven Krueger, Justin Chon, Clara Mamet",2016,85,3.7,2384,,,False,0.7338789958126027
53,Talladega Nights: The Ballad of Ricky Bobby,936,"#1 NASCAR driver Ricky Bobby stays atop the heap thanks to a pact with his best friend and teammate, Cal Naughton, Jr. But when a French Formula One driver, makes his way up the ladder, Ricky Bobby's talent and devotion are put to the test.",Adam McKay,"Will Ferrell, John C. Reilly, Sacha Baron Cohen, Gary Cole",2006,108,6.6,137502,148.21,66.0,False,-0.05913514670166012
54,Predestination,464,"For his final assignment, a top temporal agent must pursue the one criminal that has eluded him throughout time. The chase turns into a unique, surprising and mind-bending exploration of love, fate, identity and time travel taboos.",Michael Spierig,"Ethan Hawke, Sarah Snook, Noah Taylor, Madeleine West",2014,97,7.5,187760,,69.0,True,0.0405873975876943
56,Koe no katachi,862,"The story revolves around Nishimiya Shoko, a grade school student who has impaired hearing. She transfers into a new school, where she is bullied by her classmates, especially Ishida Shouya... See full summary »",Naoko Yamada,"Miyu Irino, Saori Hayami, Aoi Yuki, Kenshô Ono",2016,129,8.4,2421,,80.0,True,-0.45306319645902493
57,Happy Feet,716,"Into the world of the Emperor Penguins, who find their soul mates through song, a penguin is born who cannot sing. But he can tap dance something fierce!",George Miller,"Elijah Wood, Brittany Murphy, Hugh Jackman, Robin Williams",2006,108,6.5,141141,197.99,77.0,False,0.5377504637292847
58,Zootopia,75,"In a city of anthropomorphic animals, a rookie bunny cop and a cynical con artist fox must work together to uncover a conspiracy.",Byron Howard,"Ginnifer Goodwin, Jason Bateman, Idris Elba, Jenny Slate",2016,108,8.1,296853,341.26,78.0,False,-0.06916508269784116
59,Mr. Church,735,"""Mr. Church"" tells the story of a unique friendship that develops when a little girl and her dying mother retain the services of a talented cook - Henry Joseph Church. What begins as a six month arrangement instead spans into fifteen years and creates a family bond that lasts forever.",Bruce Beresford,"Eddie Murphy, Britt Robertson, Natascha McElhone, Xavier Samuel",2016,104,7.7,16163,0.69,37.0,True,0.4506794620737565
60,Queen of Katwe,975,A Ugandan girl sees her world rapidly change after being introduced to the game of chess.,Mira Nair,"Madina Nalwanga, David Oyelowo, Lupita Nyong'o, Martin Kabanza",2016,124,7.4,6753,8.81,73.0,True,0.9996491574810379
61,Iron Man,204,"After being held captive in an Afghan cave, billionaire engineer Tony Stark creates a unique weaponized suit of armor to fight evil.",Jon Favreau,"Robert Downey Jr., Gwyneth Paltrow, Terrence Howard, Jeff Bridges",2008,126,7.9,737719,318.3,79.0,False,-1.1184029055231106
62,The Departed,100,An undercover cop and a mole in the police attempt to identify each other while infiltrating an Irish gang in South Boston.,Martin Scorsese,"Leonardo DiCaprio, Matt Damon, Jack Nicholson, Mark Wahlberg",2006,151,8.5,937414,132.37,85.0,True,-0.3202890757031557
63,Step Up,321,"Tyler Gage receives the opportunity of a lifetime after vandalizing a performing arts school, gaining him the chance to earn a scholarship and dance with an up and coming dancer, Nora.",Anne Fletcher,"Channing Tatum, Jenna Dewan Tatum, Damaine Radcliff, De'Shawn Washington",2006,104,6.5,95960,65.27,48.0,True,-1.130254849230989
64,Deadpool,34,A fast-talking mercenary with a morbid sense of humor is subjected to a rogue experiment that leaves him with accelerated healing powers and a quest for revenge.,Tim Miller,"Ryan Reynolds, Morena Baccarin, T.J. Miller, Ed Skrein",2016,108,8.0,627797,363.02,65.0,False,0.3113822559998127
65,Shutter Island,139,"In 1954, a U.S. marshal investigates the disappearance of a murderess who escaped from a hospital for the criminally insane.",Martin Scorsese,"Leonardo DiCaprio, Emily Mortimer, Mark Ruffalo,Ben Kingsley",2010,138,8.1,855604,127.97,63.0,False,0.21862731420949516
66,The Finest Hours,577,The Coast Guard makes a daring rescue attempt off the coast of Cape Cod after a pair of oil tankers are destroyed during a blizzard in 1952.,Craig Gillespie,"Chris Pine, Casey Affleck, Ben Foster, Eric Bana",2016,117,6.8,44425,27.55,58.0,True,0.5095023387264866
67,Collateral Beauty,74,"Retreating from life after a tragedy, a man questions the universe by writing to Love, Time and Death. Receiving unexpected answers, he begins to see how these things interlock and how even loss can reveal moments of meaning and beauty.",David Frankel,"Will Smith, Edward Norton, Kate Winslet, Michael Peña",2016,97,6.8,43977,30.98,23.0,True,-0.5109679251131084
68,Seven Pounds,685,A man with a fateful secret embarks on an extraordinary journey of redemption by forever changing the lives of seven strangers.,Gabriele Muccino,"Will Smith, Rosario Dawson, Woody Harrelson,Michael Ealy",2008,123,7.7,245144,69.95,36.0,True,-0.9008873341285132
71,X-Men Origins: Wolverine,269,"A look at Wolverine's early life, in particular his time with the government squad Team X and the impact it will have on his later years.",Gavin Hood,"Hugh Jackman, Liev Schreiber, Ryan Reynolds, Danny Huston",2009,107,6.7,388447,179.88,40.0,False,-0.6465004599542064
72,Friend Request,532,"When a college student unfriends a mysterious girl online, she finds herself fighting a demonic presence that wants to make her lonely by killing her closest friends.",Simon Verhoeven,"Alycia Debnam-Carey, William Moseley, Connor Paolo, Brit Morgan",2016,92,5.4,12758,64.03,59.0,False,-0.326678119539629
73,Taken 3,625,"Ex-government operative Bryan Mills is accused of a ruthless murder he never committed or witnessed. As he is tracked and pursued, Mills brings out his particular set of skills to find the true killer and clear his name.",Olivier Megaton,"Liam Neeson, Forest Whitaker, Maggie Grace,Famke Janssen",2014,109,6.0,144715,89.25,26.0,False,0.8447008903804174
74,Transcendence,883,"A scientist's drive for artificial intelligence, takes on dangerous implications when his consciousness is uploaded into one such program.",Wally Pfister,"Johnny Depp, Rebecca Hall, Morgan Freeman, Cillian Murphy",2014,119,6.3,184564,23.01,42.0,True,0.2637303598095663
75,Riddick,945,"Left for dead on a sun-scorched planet, Riddick finds himself up against an alien race of predators. Activating an emergency beacon alerts two ships: one carrying a new breed of mercenary, the other captained by a man from Riddick's past.",David Twohy,"Vin Diesel, Karl Urban, Katee Sackhoff, Jordi Mollà",2013,119,6.4,132098,42.0,49.0,False,-1.4602617526773611
76,L'odyssée,967,"Highly influential and a fearlessly ambitious pioneer, innovator, filmmaker, researcher and conservationist, Jacques-Yves Cousteau's aquatic adventure covers roughly thirty years of an inarguably rich in achievements life.",Jérôme Salle,"Lambert Wilson, Pierre Niney, Audrey Tautou,Laurent Lucas",2016,122,6.7,1810,,70.0,False,0.9523658534774255
79,Jupiter Ascending,288,A young woman discovers her destiny as an heiress of intergalactic nobility and must fight to protect the inhabitants of Earth from an ancient and destructive industry.,Lana Wachowski,"Channing Tatum, Mila Kunis,Eddie Redmayne, Sean Bean",2015,127,5.3,150121,47.38,40.0,False,0.8312328858012134
80,Pitch Perfect 2,412,"After a humiliating command performance at The Kennedy Center, the Barden Bellas enter an international competition that no American group has ever won in order to regain their status and right to perform.",Elizabeth Banks,"Anna Kendrick, Rebel Wilson, Hailee Steinfeld,Brittany Snow",2015,115,6.5,108306,183.44,63.0,False,0.8360454104496563
81,Nymphomaniac: Vol. I,264,A self-diagnosed nymphomaniac recounts her erotic experiences to the man who saved her after a beating.,Lars von Trier,"Charlotte Gainsbourg, Stellan Skarsgård, Stacy Martin, Shia LaBeouf",2013,117,7.0,90556,0.79,64.0,True,-0.27250397732914033
82,The Other Woman,571,"After discovering her boyfriend is married, Carly soon meets the wife he's been betraying. And when yet another love affair is discovered, all three women team up to plot revenge on the three-timing S.O.B.",Nick Cassavetes,"Cameron Diaz, Leslie Mann, Kate Upton, Nikolaj Coster-Waldau",2014,109,6.0,110825,83.91,39.0,False,1.0016248043886609
85,Edge of Tomorrow,201,"A soldier fighting aliens gets to relive the same day over and over again, the day restarting every time he dies.",Doug Liman,"Tom Cruise, Emily Blunt, Bill Paxton, Brendan Gleeson",2014,113,7.9,471815,100.19,71.0,False,0.17519924268435508
86,Idiocracy,560,"Private Joe Bauers, the definition of ""average American"", is selected by the Pentagon to be the guinea pig for a top-secret hibernation program. Forgotten, he awakes five centuries in the future. He discovers a society so incredibly dumbed down that he's easily the most intelligent person alive.",Mike Judge,"Luke Wilson, Maya Rudolph, Dax Shepard, Terry Crews",2006,84,6.6,115355,0.44,66.0,False,-0.004416652744368471
89,Piranha 3D,889,"After a sudden underwater tremor sets free scores of the prehistoric man-eating fish, an unlikely group of strangers must band together to stop themselves from becoming fish food for the area's new razor-toothed residents.",Alexandre Aja,"Elisabeth Shue, Jerry O'Connell, Richard Dreyfuss,Ving Rhames",2010,88,5.5,75262,25.0,53.0,False,0.5430003912138285
90,No Country for Old Men,137,Violence and mayhem ensue after a hunter stumbles upon a drug deal gone wrong and more than two million dollars in cash near the Rio Grande.,Ethan Coen,"Tommy Lee Jones, Javier Bardem, Josh Brolin, Woody Harrelson",2007,122,8.1,660286,74.27,91.0,True,2.4842325599164536
91,I Am Number Four,455,"Aliens and their Guardians are hiding on Earth from intergalactic bounty hunters. They can only be killed in numerical order, and Number Four is next on the list. This is his story.",D.J. Caruso,"Alex Pettyfer, Timothy Olyphant, Dianna Agron, Teresa Palmer",2011,109,6.1,202682,55.09,36.0,False,-1.3279972648309963
92,Devil's Knot,671,The savage murders of three young children sparks a controversial trial of three teenagers accused of killing the kids as part of a satanic ritual.,Atom Egoyan,"Colin Firth, Reese Witherspoon, Alessandro Nivola,James Hamrick",2013,114,6.1,15514,,42.0,True,-0.652931851690552
93,USS Indianapolis: Men of Courage,810,"During World War II, an American navy ship is sunk by a Japanese submarine leaving 300 crewmen stranded in shark infested waters.",Mario Van Peebles,"Nicolas Cage, Tom Sizemore, Thomas Jane,Matt Lanter",2016,128,5.2,4964,,30.0,True,-1.3731028500260374
95,Demain tout commence,357,Samuel parties hard in the Marseille area of France and is awoken one morning by a woman carrying a baby she claims is his. She drives off leaving him with a wailing infant; he gives chase ... See full summary »,Hugo Gélin,"Omar Sy, Clémence Poésy, Antoine Bertrand, Ashley Walters",2016,118,7.4,5496,,,True,0.7789946246522479
97,Allegiant,205,"After the earth-shattering revelations of Insurgent, Tris must escape with Four beyond the wall that encircles Chicago, to finally discover the shocking truth of the world around them.",Robert Schwentke,"Shailene Woodley, Theo James, Jeff Daniels,Naomi Watts",2016,120,5.7,70504,66.0,33.0,False,-0.01883911975380938
98,Love & Friendship,683,"Lady Susan Vernon takes up temporary residence at her in-laws' estate and, while there, is determined to be a matchmaker for her daughter Frederica -- and herself too, naturally.",Whit Stillman,"Kate Beckinsale, Chloë Sevigny, Xavier Samuel,Emma Greenwell",2016,90,6.5,16164,14.01,87.0,True,-0.03104182949926206
99,Avatar,88,A paraplegic marine dispatched to the moon Pandora on a unique mission becomes torn between following his orders and protecting the world he feels is his home.,James Cameron,"Sam Worthington, Zoe Saldana, Sigourney Weaver, Michelle Rodriguez",2009,162,7.8,935408,760.51,83.0,False,-0.8851575247644571
100,Transformers: Dark of the Moon,567,"The Autobots learn of a Cybertronian spacecraft hidden on the moon, and race against the Decepticons to reach it and to learn its secrets.",Michael Bay,"Shia LaBeouf, Rosie Huntington-Whiteley, Tyrese Gibson, Josh Duhamel",2011,154,6.3,338369,352.36,42.0,False,-0.2152096224756365
