,Title,Rank,Description,Director,Actors,Year,Runtime (Minutes),Rating,Votes,Revenue (Millions),Metascore,Genre_is_Drama,split
501,Everybody Wants Some!!,279,"In 1980, a group of college baseball players navigate their way through the freedoms and responsibilities of unsupervised adulthood.",Richard Linklater,"Blake Jenner, Tyler Hoechlin, Ryan Guzman,Zoey Deutch",2016,117,7.0,36312,3.37,83.0,False,1.9414249340569723
502,1408,805,"A man who specializes in debunking paranormal occurrences checks into the fabled room 1408 in the Dolphin Hotel. Soon after settling in, he confronts genuine terror.",Mikael Håfström,"John Cusack, Samuel L. Jackson, Mary McCormack, Paul Birchard",2007,104,6.8,221073,71.98,64.0,False,-1.4344456449501315
503,The Happening,513,"A science teacher, his wife, and a young girl struggle to survive a plague that causes those infected to commit suicide.",M. Night Shyamalan,"Mark Wahlberg, Zooey Deschanel, John Leguizamo, Ashlyn Sanchez",2008,91,5.0,170897,64.51,34.0,False,0.4366571169139862
504,Watchmen,148,"In 1985 where former superheroes exist, the murder of a colleague sends active vigilante Rorschach into his own sprawling investigation, uncovering something that could completely change the course of history as we know it.",Zack Snyder,"Jackie Earle Haley, Patrick Wilson, Carla Gugino,Malin Akerman",2009,162,7.6,410249,107.5,56.0,True,1.0546425070818868
505,The First Time,662,A shy senior and a down-to-earth junior fall in love over one weekend.,Jon Kasdan,"Dylan O'Brien, Britt Robertson, Victoria Justice, James Frecheville",2012,95,6.9,54027,0.02,55.0,True,-0.4976011068781623
506,Bride Wars,900,Two best friends become rivals when they schedule their respective weddings on the same day.,Gary Winick,"Kate Hudson, Anne Hathaway, Candice Bergen, Bryan Greenberg",2009,89,5.5,83976,58.72,24.0,False,2.6738761430985476
507,Spectre,170,"A cryptic message from Bond's past sends him on a trail to uncover a sinister organization. While M battles political forces to keep the secret service alive, Bond peels back the layers of deceit to reveal the terrible truth behind SPECTRE.",Sam Mendes,"Daniel Craig, Christoph Waltz, Léa Seydoux, Ralph Fiennes",2015,148,6.8,308981,200.07,60.0,False,0.8445659561697956
508,Rock of Ages,973,"A small town girl and a city boy meet on the Sunset Strip, while pursuing their Hollywood dreams.",Adam Shankman,"Julianne Hough, Diego Boneta, Tom Cruise, Alec Baldwin",2012,123,5.9,64513,38.51,47.0,True,0.7444107721819377
509,Don't Fuck in the Woods,43,"A group of friends are going on a camping trip to celebrate graduating college. But once they enter the woods, the proverbial shit starts to hit the fan.",Shawn Burkett,"Brittany Blanton, Ayse Howard, Roman Jossart,Nadia White",2016,73,2.7,496,,,False,-0.169720211881783
510,Elle,414,A successful businesswoman gets caught up in a game of cat and mouse as she tracks down the unknown man who raped her.,Paul Verhoeven,"Isabelle Huppert, Laurent Lafitte, Anne Consigny,Charles Berling",2016,130,7.2,35417,,89.0,True,0.32156601399518264
511,Beowulf,803,"The warrior Beowulf must fight and defeat the monster Grendel who is terrorizing Denmark, and later, Grendel's mother, who begins killing out of revenge.",Robert Zemeckis,"Ray Winstone, Crispin Glover, Angelina Jolie,Robin Wright",2007,115,6.2,146566,82.16,59.0,False,0.3093586984405135
512,Swiss Army Man,379,A hopeless man stranded on a deserted island befriends a dead body and together they go on a surreal journey to get home.,Dan Kwan,"Paul Dano, Daniel Radcliffe, Mary Elizabeth Winstead, Antonia Ribero",2016,97,7.1,61812,4.21,64.0,True,0.8319944131739545
513,Anthropoid,521,"Based on the extraordinary true story of Operation Anthropoid, the WWII mission to assassinate SS General Reinhard Heydrich, the main architect behind the Final Solution and the Reich's third in command after Hitler and Himmler.",Sean Ellis,"Jamie Dornan, Cillian Murphy, Brian Caspe, Karel Hermánek Jr.",2016,120,7.2,24100,2.96,59.0,False,0.14354090225842278
515,Pineapple Express,661,A process server and his marijuana dealer wind up on the run from hitmen and a corrupt police officer after he witnesses his dealer's boss murder a competitor while trying to serve papers on him.,David Gordon Green,"Seth Rogen, James Franco, Gary Cole, Danny McBride",2008,111,7.0,267872,87.34,64.0,False,0.48902458708095414
516,What We Do in the Shadows,381,"A documentary team films the lives of a group of vampires for a few months. The vampires share a house in Wellington, New Zealand. Turns out vampires have their own domestic problems too.",Jemaine Clement,"Jemaine Clement, Taika Waititi,Cori Gonzalez-Macuer, Jonny Brugh",2014,86,7.6,84016,3.33,76.0,False,-0.4808332887983749
517,The Intent,891,"Gunz (Dylan Duffus) is thrust into a world of excitement when he joins the TIC crew. The crew, led by the ruthless Hoodz (Scorcher), goes from low level weed peddling to full on armed ... See full summary »",Femi Oyeniran,"Dylan Duffus, Scorcher,Shone Romulus, Jade Asha",2016,104,3.5,202,,59.0,True,0.7539022656439807
518,The Boy Next Door,556,"A woman, separated from her unfaithful husband, falls for a younger man who has moved in next door, but their torrid affair soon takes a dangerous turn.",Rob Cohen,"Jennifer Lopez, Ryan Guzman, Kristin Chenoweth, John Corbett",2015,91,4.6,30180,35.39,30.0,False,1.216685651219812
519,Les Misérables,246,"In 19th-century France, Jean Valjean, who for decades has been hunted by the ruthless policeman Javert after breaking parole, agrees to care for a factory worker's daughter. The decision changes their lives forever.",Tom Hooper,"Hugh Jackman, Russell Crowe, Anne Hathaway,Amanda Seyfried",2012,158,7.6,257426,148.78,63.0,True,-1.1861463657894586
520,Man on a Ledge,795,"As a police psychologist works to talk down an ex-con who is threatening to jump from a Manhattan hotel rooftop, the biggest diamond heist ever committed is in motion.",Asger Leth,"Sam Worthington, Elizabeth Banks, Jamie Bell, Mandy Gonzalez",2012,102,6.6,129252,18.6,40.0,False,-1.395075219495045
521,Room,144,A young boy is raised within the confines of a small shed.,Lenny Abrahamson,"Brie Larson, Jacob Tremblay, Sean Bridgers,Wendy Crewson",2015,118,8.2,224132,14.68,86.0,True,1.8229857171220734
522,The Twilight Saga: Breaking Dawn - Part 1,926,"The Quileutes close in on expecting parents Edward and Bella, whose unborn child poses a threat to the Wolf Pack and the towns people of Forks.",Bill Condon,"Kristen Stewart, Robert Pattinson, Taylor Lautner, Gil Birmingham",2011,117,4.9,190244,281.28,45.0,True,0.5023909424856512
523,Brooklyn,442,"An Irish immigrant lands in 1950s Brooklyn, where she quickly falls into a romance with a local. When her past catches up with her, however, she must choose between two countries and the lives that exist within.",John Crowley,"Saoirse Ronan, Emory Cohen, Domhnall Gleeson,Jim Broadbent",2015,117,7.5,94977,38.32,87.0,True,0.737842616958406
524,Rush,335,The merciless 1970s rivalry between Formula One rivals James Hunt and Niki Lauda.,Ron Howard,"Daniel Brühl, Chris Hemsworth, Olivia Wilde,Alexandra Maria Lara",2013,123,8.1,339722,26.9,75.0,True,-1.3935654637468144
526,The Conjuring,255,Paranormal investigators Ed and Lorraine Warren work to help a family terrorized by a dark presence in their farmhouse.,James Wan,"Patrick Wilson, Vera Farmiga, Ron Livingston, Lili Taylor",2013,112,7.5,330305,137.39,68.0,False,-0.304803854270317
527,Sex and the City 2,953,"While wrestling with the pressures of life, love, and work in Manhattan, Carrie, Miranda, and Charlotte join Samantha for a trip to Abu Dhabi (United Arab Emirates), where Samantha's ex is filming a new movie.",Michael Patrick King,"Sarah Jessica Parker, Kim Cattrall, Kristin Davis, Cynthia Nixon",2010,146,4.3,62403,95.33,27.0,True,0.3231372759262653
528,Vampire Academy,650,"Rose Hathaway is a Dhampir, half human-half vampire, a guardian of the Moroi, peaceful, mortal vampires living discreetly within our world. Her calling is to protect the Moroi from bloodthirsty, immortal Vampires, the Strigoi.",Mark Waters,"Zoey Deutch, Lucy Fry, Danila Kozlovsky, Gabriel Byrne",2014,104,5.6,44111,7.79,30.0,False,-0.8600356007817664
529,2012,473,A frustrated writer struggles to keep his family alive when a series of global catastrophes threatens to annihilate mankind.,Roland Emmerich,"John Cusack, Thandie Newton, Chiwetel Ejiofor,Amanda Peet",2009,158,5.8,297984,166.11,49.0,False,0.6200247604942485
532,High-Rise,770,Life for the residents of a tower block begins to run out of control.,Ben Wheatley,"Tom Hiddleston, Jeremy Irons, Sienna Miller, Luke Evans",2015,119,5.7,25928,0.34,65.0,True,0.5517641659204027
533,The Expendables 3,380,"Barney augments his team with new blood for a personal battle: to take down Conrad Stonebanks, the Expendables co-founder and notorious arms trader who is hell bent on wiping out Barney and every single one of his associates.",Patrick Hughes,"Sylvester Stallone, Jason Statham, Jet Li, Antonio Banderas",2014,126,6.1,137568,39.29,35.0,False,-0.13809356618333435
534,The Fighter,760,"A look at the early years of boxer ""Irish"" Micky Ward and his brother who helped train him before going pro in the mid 1980s.",David O. Russell,"Mark Wahlberg, Christian Bale, Amy Adams,Melissa Leo",2010,116,7.8,290056,93.57,79.0,True,0.3241038639089986
535,Bacalaureat,837,A film about compromises and the implications of the parent's role.,Cristian Mungiu,"Adrian Titieni, Maria-Victoria Dragus, Lia Bugnar,Malina Manovici",2016,128,7.5,5531,0.13,84.0,True,1.654820590212972
538,The Equalizer,301,"A man believes he has put his mysterious past behind him and has dedicated himself to beginning a new, quiet life. But when he meets a young girl under the control of ultra-violent Russian gangsters, he can't stand idly by - he has to help her.",Antoine Fuqua,"Denzel Washington, Marton Csokas, Chloë Grace Moretz, David Harbour",2014,132,7.2,249425,101.53,57.0,False,-0.6849491326278155
539,"Hail, Caesar!",365,A Hollywood fixer in the 1950s works to keep the studio's stars in line.,Ethan Coen,"Josh Brolin, George Clooney, Alden Ehrenreich, Ralph Fiennes",2016,106,6.3,89059,30.0,72.0,False,-0.39478263521610113
540,The imposible,438,The story of a tourist family in Thailand caught in the destruction and chaotic aftermath of the 2004 Indian Ocean tsunami.,J.A. Bayona,"Naomi Watts, Ewan McGregor, Tom Holland, Oaklee Pendergast",2012,114,7.6,156189,19.0,73.0,True,-0.28684955548846025
541,The Wolverine,389,"When Wolverine is summoned to Japan by an old acquaintance, he is embroiled in a conflict that forces him to confront his own demons.",James Mangold,"Hugh Jackman, Will Yun Lee, Tao Okamoto, Rila Fukushima",2013,126,6.7,355362,132.55,60.0,False,-0.6396696559265622
542,Grimsby,598,A new assignment forces a top spy to team up with his football hooligan brother.,Louis Leterrier,"Sacha Baron Cohen, Mark Strong, Rebel Wilson,Freddie Crowder",2016,83,6.2,63408,6.86,44.0,False,0.6360355848914138
543,The Headhunter's Calling,417,"A headhunter whose life revolves around closing deals in a a survival-of-the-fittest boiler room, battles his top rival for control of their job placement company -- his dream of owning the company clashing with the needs of his family.",Mark Williams,"Alison Brie, Gerard Butler, Willem Dafoe, Gretchen Mol",2016,108,6.9,164,,85.0,True,-0.2364836590082007
544,Trainwreck,190,"Having thought that monogamy was never possible, a commitment-phobic career woman may have to face her fears when she meets a good guy.",Judd Apatow,"Amy Schumer, Bill Hader, Brie Larson, Colin Quinn",2015,125,6.3,106364,110.01,75.0,True,-1.8871804857176837
545,The Hurt Locker,673,"During the Iraq War, a Sergeant recently assigned to an army bomb squad is put at odds with his squad mates due to his maverick way of handling his work.",Kathryn Bigelow,"Jeremy Renner, Anthony Mackie, Brian Geraghty,Guy Pearce",2008,131,7.6,352023,15.7,94.0,True,0.8826704847469341
546,Silent Hill,446,"A woman, Rose, goes in search for her adopted daughter within the confines of a strange, desolate town called Silent Hill.",Christophe Gans,"Radha Mitchell, Laurie Holden, Sean Bean,Deborah Kara Unger",2006,125,6.6,184152,46.98,,False,-1.0895612156750025
547,Billy Lynn's Long Halftime Walk,187,19-year-old Billy Lynn is brought home for a victory tour after a harrowing Iraq battle. Through flashbacks the film shows what really happened to his squad - contrasting the realities of war with America's perceptions.,Ang Lee,"Joe Alwyn, Garrett Hedlund, Arturo Castro, Mason Lee",2016,113,6.3,11944,1.72,53.0,True,-0.4316686284211351
549,Lída Baarová,755,A film about the black-and-white era actress Lída Baarová and her doomed love affair.,Filip Renc,"Tatiana Pauhofová, Karl Markovics, Gedeon Burkhard,Simona Stasová",2016,106,5.0,353,,64.0,True,0.6880382024550353
550,Dear White People,263,The lives of four black students at an Ivy League college.,Justin Simien,"Tyler James Williams, Tessa Thompson, Kyle Gallner,Teyonah Parris",2014,108,6.2,21715,4.4,79.0,True,-0.4124139683730594
551,WALL·E,635,"In the distant future, a small waste-collecting robot inadvertently embarks on a space journey that will ultimately decide the fate of mankind.",Andrew Stanton,"Ben Burtt, Elissa Knight, Jeff Garlin, Fred Willard",2008,98,8.4,776897,223.81,,False,-1.883995902440451
552,Law Abiding Citizen,499,A frustrated man decides to take justice into his own hands after a plea bargain sets one of his family's killers free. He targets not only the killer but also the district attorney and others involved in the deal.,F. Gary Gray,"Gerard Butler, Jamie Foxx, Leslie Bibb, Colm Meaney",2009,109,7.4,228339,73.34,34.0,True,0.45682089917700575
553,Pirates of the Caribbean: Dead Man's Chest,79,"Jack Sparrow races to recover the heart of Davy Jones to avoid enslaving his soul to Jones' service, as other friends and foes seek the heart for their own agenda as well.",Gore Verbinski,"Johnny Depp, Orlando Bloom, Keira Knightley, Jack Davenport",2006,151,7.3,552027,423.03,53.0,False,-0.7064172542418831
554,Her,174,A lonely writer develops an unlikely relationship with an operating system designed to meet his every need.,Spike Jonze,"Joaquin Phoenix, Amy Adams, Scarlett Johansson,Rooney Mara",2013,126,8.0,390531,25.56,90.0,True,-0.9024290988159838
555,Gone Girl,84,"With his wife's disappearance having become the focus of an intense media circus, a man sees the spotlight turned on him when it's suspected that he may not be innocent.",David Fincher,"Ben Affleck, Rosamund Pike, Neil Patrick Harris,Tyler Perry",2014,149,8.1,636243,167.74,79.0,True,0.6965911528643847
556,Sucker Punch,286,"A young girl is institutionalized by her abusive stepfather, retreating to an alternative reality as a coping strategy, envisioning a plan to help her escape.",Zack Snyder,"Emily Browning, Vanessa Hudgens, Abbie Cornish,Jena Malone",2011,110,6.1,204874,36.38,33.0,False,-1.3391775791283878
557,Up in the Air,940,"Ryan Bingham enjoys living out of a suitcase for his job traveling around the country firing people, but finds that lifestyle threatened by the presence of a potential love interest and a new hire.",Jason Reitman,"George Clooney, Vera Farmiga, Anna Kendrick,Jason Bateman",2009,109,7.4,279694,83.81,,True,1.6039012782803141
558,The Age of Shadows,680,Japanese agents close in as members of the Korean resistance plan an attack in 1920's Seoul.,Jee-woon Kim,"Byung-hun Lee, Yoo Gong, Kang-ho Song, Ji-min Han",2016,140,7.2,2403,0.54,78.0,True,-0.2791231791053701
559,Good Kids,929,Four high school students look to redefine themselves after graduation.,Chris McCoy,"Zoey Deutch, Nicholas Braun, Mateo Arias, Israel Broussard",2016,86,6.1,3843,,86.0,False,0.34159018034029204
560,Exodus: Gods and Kings,517,"The defiant leader Moses rises up against the Egyptian Pharaoh Ramses, setting 600,000 slaves on a monumental journey of escape from Egypt and its terrifying cycle of deadly plagues.",Ridley Scott,"Christian Bale, Joel Edgerton, Ben Kingsley, Sigourney Weaver",2014,150,6.0,137299,65.01,52.0,True,-0.9690154722760947
561,How to Train Your Dragon 2,904,"When Hiccup and Toothless discover an ice cave that is home to hundreds of new wild dragons and the mysterious Dragon Rider, the two friends find themselves at the center of a battle to protect the peace.",Dean DeBlois,"Jay Baruchel, Cate Blanchett, Gerard Butler, Craig Ferguson",2014,102,7.9,237565,177.0,76.0,False,0.4552089405875034
563,American Hustle,348,"A con man, Irving Rosenfeld, along with his seductive partner Sydney Prosser, is forced to work for a wild FBI agent, Richie DiMaso, who pushes them into a world of Jersey powerbrokers and mafia.",David O. Russell,"Christian Bale, Amy Adams, Bradley Cooper,Jennifer Lawrence",2013,138,7.3,379088,150.12,90.0,True,-1.5775597176535967
564,The Secret Scripture,787,A woman keeps a diary of her extended stay at a mental hospital.,Jim Sheridan,"Rooney Mara, Eric Bana, Theo James, Aidan Turner",2016,108,6.8,378,,37.0,True,1.1707560434715083
566,Hunger,687,Irish republican Bobby Sands leads the inmates of a Northern Irish prison in a hunger strike.,Steve McQueen,"Stuart Graham, Laine Megaw, Brian Milligan, Liam McMahon",2008,96,7.6,54486,0.15,82.0,True,-0.8744901783187893
567,Frantz,644,"In the aftermath of WWI, a young German who grieves the death of her fiancé in France meets a mysterious Frenchman who visits the fiancé's grave to lay flowers.",François Ozon,"Pierre Niney, Paula Beer, Ernst Stötzner, Marie Gruber",2016,113,7.5,4304,0.86,73.0,True,0.8654842978896605
568,Central Intelligence,200,"After he reconnects with an awkward pal from high school through Facebook, a mild-mannered accountant is lured into the world of international espionage.",Rawson Marshall Thurber,"Dwayne Johnson, Kevin Hart, Danielle Nicolet, Amy Ryan",2016,107,6.3,97082,127.38,52.0,False,-1.373559555211549
570,Twilight,166,A teenage girl risks everything when she falls in love with a vampire.,Catherine Hardwicke,"Kristen Stewart, Robert Pattinson, Billy Burke,Sarah Clarke",2008,122,5.2,361449,191.45,56.0,True,-2.287905199825121
571,The Siege of Jadotville,939,Irish Commandant Pat Quinlan leads a stand off with troops against French and Belgian Mercenaries in the Congo during the early 1960s.,Richie Smyth,"Jamie Dornan, Mark Strong, Jason O'Mara, Michael McElhatton",2016,108,7.3,14689,,83.0,True,-0.02785280859417566
572,Kimi no na wa,97,"Two strangers find themselves linked in a bizarre way. When a connection forms, will distance be the only thing to keep them apart?",Makoto Shinkai,"Ryûnosuke Kamiki, Mone Kamishiraishi, Ryô Narita, Aoi Yuki",2016,106,8.6,34110,4.68,79.0,True,0.04780265573529457
573,Death Race,955,Ex-con Jensen Ames is forced by the warden of a notorious prison to compete in our post-industrial world's most popular sport: a car race in which inmates must brutalize and kill one another on the road to victory.,Paul W.S. Anderson,"Jason Statham, Joan Allen, Tyrese Gibson, Ian McShane",2008,105,6.4,173731,36.06,43.0,False,-1.057556934173192
574,Pitch Perfect,292,"Beca, a freshman at Barden University, is cajoled into joining The Bellas, her school's all-girls singing group. Injecting some much needed energy into their repertoire, The Bellas take on their male rivals in a campus competition.",Jason Moore,"Anna Kendrick, Brittany Snow, Rebel Wilson, Anna Camp",2012,112,7.2,226631,65.0,66.0,False,-1.5004469253616048
576,Selma,990,"A chronicle of Martin Luther King's campaign to secure equal voting rights via an epic march from Selma to Montgomery, Alabama in 1965.",Ava DuVernay,"David Oyelowo, Carmen Ejogo, Tim Roth, Lorraine Toussaint",2014,128,7.5,67637,52.07,,True,-1.7027779812329997
577,The Expendables,561,A CIA operative hires a team of mercenaries to eliminate a Latin dictator and a renegade CIA agent.,Sylvester Stallone,"Sylvester Stallone, Jason Statham, Jet Li, Dolph Lundgren",2010,103,6.5,283282,102.98,45.0,False,-1.0231885782671999
578,Live by Night,87,"A group of Boston-bred gangsters set up shop in balmy Florida during the Prohibition era, facing off against the competition and the Ku Klux Klan.",Ben Affleck,"Ben Affleck, Elle Fanning, Brendan Gleeson, Chris Messina",2016,129,6.4,27869,10.38,49.0,True,-1.0605013202512186
579,Me Before You,58,A girl in a small town forms an unlikely bond with a recently-paralyzed man she's taking care of.,Thea Sharrock,"Emilia Clarke, Sam Claflin, Janet McTeer, Charles Dance",2016,106,7.4,113322,56.23,51.0,True,-1.9910237157521218
580,Resident Evil: Afterlife,994,"While still out to destroy the evil Umbrella Corporation, Alice joins a group of survivors living in a prison surrounded by the infected who also want to relocate to the mysterious but supposedly unharmed safe haven known only as Arcadia.",Paul W.S. Anderson,"Milla Jovovich, Ali Larter, Wentworth Miller,Kim Coates",2010,97,5.9,140900,60.13,37.0,False,0.4383462967379221
581,Inception,81,"A thief, who steals corporate secrets through use of dream-sharing technology, is given the inverse task of planting an idea into the mind of a CEO.",Christopher Nolan,"Leonardo DiCaprio, Joseph Gordon-Levitt, Ellen Page, Ken Watanabe",2010,148,8.8,1583625,292.57,74.0,False,1.3324391655665835
583,Terminator Salvation,857,"In 2018, a mysterious new weapon in the war against the machines, half-human and half-machine, comes to John Connor on the eve of a resistance attack on Skynet. But whose side is he on, and can he be trusted?",McG,"Christian Bale, Sam Worthington, Anton Yelchin, Moon Bloodgood",2009,115,6.6,297093,125.32,49.0,True,-0.20572917296848656
584,Life of Pi,695,"A young man who survives a disaster at sea is hurtled into an epic journey of adventure and discovery. While cast away, he forms an unexpected connection with another survivor: a fearsome Bengal tiger.",Ang Lee,"Suraj Sharma, Irrfan Khan, Adil Hussain, Tabu",2012,127,7.9,471109,124.98,79.0,True,-0.6324990402821082
585,Hands of Stone,742,The legendary Roberto Duran and his equally legendary trainer Ray Arcel change each other's lives.,Jonathan Jakubowicz,"Edgar Ramírez, Usher Raymond, Robert De Niro, Rubén Blades",2016,111,6.6,8998,4.71,54.0,True,-1.3181784111446009
586,Atonement,418,"Fledgling writer Briony Tallis, as a thirteen-year-old, irrevocably changes the course of several lives when she accuses her older sister's lover of a crime he did not commit.",Joe Wright,"Keira Knightley, James McAvoy, Brenda Blethyn,Saoirse Ronan",2007,123,7.8,202890,50.92,,True,0.09717309837587586
590,My Big Fat Greek Wedding 2,976,A Portokalos family secret brings the beloved characters back together for an even bigger and Greeker wedding.,Kirk Jones,"Nia Vardalos, John Corbett, Michael Constantine, Lainie Kazan",2016,94,6.0,20966,59.57,37.0,False,0.8922651009117988
591,The Hobbit: The Desolation of Smaug,519,"The dwarves, along with Bilbo Baggins and Gandalf the Grey, continue their quest to reclaim Erebor, their homeland, from Smaug. Bilbo Baggins is in possession of a mysterious and magical ring.",Peter Jackson,"Ian McKellen, Martin Freeman, Richard Armitage,Ken Stott",2013,161,7.9,513744,258.36,66.0,False,-1.7912462036276349
593,Inferno,150,"When Robert Langdon wakes up in an Italian hospital with amnesia, he teams up with Dr. Sienna Brooks, and together they must race across Europe against the clock to foil a deadly global plot.",Ron Howard,"Tom Hanks, Felicity Jones, Irrfan Khan, Ben Foster",2016,121,6.2,97623,34.26,42.0,False,-0.7925091368171674
594,Gangster Squad,601,"It's 1949 Los Angeles, the city is run by gangsters and a malicious mobster, Mickey Cohen. Determined to end the corruption, John O'Mara assembles a team of cops, ready to take down the ruthless leader and restore peace to the city.",Ruben Fleischer,"Sean Penn, Ryan Gosling, Emma Stone, Giovanni Ribisi",2013,113,6.7,181432,46.0,40.0,True,0.12571208151527974
595,A United Kingdom,809,"The story of King Seretse Khama of Botswana and how his loving but controversial marriage to a British white woman, Ruth Williams, put his kingdom into political and diplomatic turmoil.",Amma Asante,"David Oyelowo, Rosamund Pike, Tom Felton, Jack Davenport",2016,111,6.8,4771,3.9,65.0,True,0.6409613264749917
596,The Help,93,"An aspiring author during the civil rights movement of the 1960s decides to write a book detailing the African American maids' point of view on the white families for which they work, and the hardships they go through on a daily basis.",Tate Taylor,"Emma Stone, Viola Davis, Octavia Spencer, Bryce Dallas Howard",2011,146,8.1,342429,169.71,62.0,True,1.7742002073619472
598,Super 8,498,"During the summer of 1979, a group of friends witness a train crash and investigate subsequent unexplained events in their small town.",J.J. Abrams,"Elle Fanning, AJ Michalka, Kyle Chandler, Joel Courtney",2011,112,7.1,298913,126.98,72.0,False,1.058482440211895
599,This Is the End,359,"While attending a party at James Franco's house, Seth Rogen, Jay Baruchel and many other celebrities are faced with the Biblical Apocalypse.",Evan Goldberg,"James Franco, Jonah Hill, Seth Rogen,Jay Baruchel",2013,107,6.6,327838,101.47,67.0,False,-0.5413116211610067
603,Drive,189,A mysterious Hollywood stuntman and mechanic moonlights as a getaway driver and finds himself in trouble when he helps out his neighbor.,Nicolas Winding Refn,"Ryan Gosling, Carey Mulligan, Bryan Cranston, Albert Brooks",2011,100,7.8,461509,35.05,78.0,True,-0.40981873240545685
604,Fast & Furious,341,"Brian O'Conner, back working for the FBI in Los Angeles, teams up with Dominic Toretto to bring down a heroin importer by infiltrating his operation.",Justin Lin,"Vin Diesel, Paul Walker, Michelle Rodriguez, Jordana Brewster",2009,107,6.6,217464,155.02,46.0,False,0.4481559034708985
