,Title,Rank,Description,Director,Actors,Year,Runtime (Minutes),Rating,Votes,Revenue (Millions),Metascore,Genre_is_Drama,split
407,The Lives of Others,477,"In 1984 East Berlin, an agent of the secret police, conducting surveillance on a writer and his lover, finds himself becoming increasingly absorbed by their lives.",Florian Henckel von Donnersmarck,"Ulrich Mühe, Martina Gedeck,Sebastian Koch, Ulrich Tukur",2006,137,8.5,278103,11.28,89.0,True,-1.8701940033990778
408,Eddie the Eagle,476,"The story of Eddie Edwards, the notoriously tenacious British underdog ski jumper who charmed the world at the 1988 Winter Olympics.",Dexter Fletcher,"Taron Egerton, Hugh Jackman, Tom Costello, Jo Hartley",2016,106,7.4,56332,15.79,54.0,True,2.2749698296565337
409,Il racconto dei racconti - Tale of Tales,911,"From the bitter quest of the Queen of Longtrellis, to two mysterious sisters who provoke the passion of a king, to the King of Highhills obsessed with a giant Flea, these tales are inspired by the fairytales by Giambattista Basile.",Matteo Garrone,"Salma Hayek, Vincent Cassel, Toby Jones, John C. Reilly",2015,133,6.4,17565,0.08,72.0,True,-0.05533980095236105
410,The Secret Life of Pets,16,"The quiet life of a terrier named Max is upended when his owner takes in Duke, a stray whom Max instantly dislikes.",Chris Renaud,"Louis C.K., Eric Stonestreet, Kevin Hart, Lake Bell",2016,87,6.6,120259,368.31,61.0,False,1.697552456363902
411,Don't Think Twice,547,"When a member of a popular New York City improv troupe gets a huge break, the rest of the group - all best friends - start to realize that not everyone is going to make it after all.",Mike Birbiglia,"Keegan-Michael Key, Gillian Jacobs, Mike Birbiglia,Chris Gethard",2016,92,6.8,10485,4.42,83.0,True,-0.9786435880626184
412,42,850,This movie is about Jackie Robinson and his journey to becoming a Brooklyn Dodger and his life during that time.,Brian Helgeland,"Chadwick Boseman, T.R. Knight, Harrison Ford,Nicole Beharie",2013,128,7.5,69659,95.0,62.0,True,0.6923739151993716
414,Star Trek,141,The brash James T. Kirk tries to live up to his father's legacy with Mr. Spock keeping him in check as a vengeful Romulan from the future creates black holes to destroy the Federation one planet at a time.,J.J. Abrams,"Chris Pine, Zachary Quinto, Simon Pegg, Leonard Nimoy",2009,127,8.0,526324,257.7,82.0,False,1.1706278288042093
415,PK,766,"A stranger in the city asks questions no one has asked before. His childlike curiosity will take him on a journey of love, laughter, and letting go.",Rajkumar Hirani,"Aamir Khan, Anushka Sharma, Sanjay Dutt,Boman Irani",2014,153,8.2,103279,10.57,51.0,True,1.716824311142812
416,Green Room,329,A punk rock band is forced to fight for survival after witnessing a murder at a neo-Nazi skinhead bar.,Jeremy Saulnier,"Anton Yelchin, Imogen Poots, Alia Shawkat,Patrick Stewart",2015,95,7.0,62885,3.22,79.0,False,0.5714994050184802
417,Safe Haven,488,"A young woman with a mysterious past lands in Southport, North Carolina where her bond with a widower forces her to confront the dark secret that haunts her.",Lasse Hallström,"Julianne Hough, Josh Duhamel, Cobie Smulders,David Lyons",2013,115,6.7,84765,71.35,34.0,True,-0.03769755174972345
418,Black Swan,262,"A committed dancer wins the lead role in a production of Tchaikovsky's ""Swan Lake"" only to find herself struggling to maintain her sanity.",Darren Aronofsky,"Natalie Portman, Mila Kunis, Vincent Cassel,Winona Ryder",2010,108,8.0,581518,106.95,79.0,True,-0.5103963794634304
419,Stardust,347,"In a countryside town bordering on a magical land, a young man makes a promise to his beloved that he'll retrieve a fallen star by venturing into the magical realm.",Matthew Vaughn,"Charlie Cox, Claire Danes, Sienna Miller, Ian McKellen",2007,127,7.7,220664,38.35,66.0,False,1.4019969821716836
420,Norman: The Moderate Rise and Tragic Fall of a New York Fixer,260,"Norman Oppenheimer is a small time operator who befriends a young politician at a low point in his life. Three years later, when the politician becomes an influential world leader, Norman's life dramatically changes for better and worse.",Joseph Cedar,"Richard Gere, Lior Ashkenazi, Michael Sheen,Charlotte Gainsbourg",2016,118,7.1,664,2.27,76.0,True,0.3462298778896013
421,The Master,930,A Naval veteran arrives home from war unsettled and uncertain of his future - until he is tantalized by The Cause and its charismatic leader.,Paul Thomas Anderson,"Philip Seymour Hoffman, Joaquin Phoenix,Amy Adams, Jesse Plemons",2012,144,7.1,112902,16.38,,True,2.2499098854741577
422,Take Me Home Tonight,993,"Four years after graduation, an awkward high school genius uses his sister's boyfriend's Labor Day party as the perfect opportunity to make his move on his high school crush.",Michael Dowse,"Topher Grace, Anna Faris, Dan Fogler, Teresa Palmer",2011,97,6.3,45419,6.92,,True,-2.050208106234786
423,Tangled,408,"The magically long-haired Rapunzel has spent her entire life in a tower, but now that a runaway thief has stumbled upon her, she is about to discover the world for the first time, and who she really is.",Nathan Greno,"Mandy Moore, Zachary Levi, Donna Murphy, Ron Perlman",2010,100,7.8,316459,200.81,71.0,False,-0.48872286998702125
424,Dangal,118,Former wrestler Mahavir Singh Phogat and his two wrestler daughters struggle towards glory at the Commonwealth Games in the face of societal oppression.,Nitesh Tiwari,"Aamir Khan, Sakshi Tanwar, Fatima Sana Shaikh,Sanya Malhotra",2016,161,8.8,48969,11.15,,True,1.0813458342526492
425,Relatos salvajes,642,Six short stories that explore the extremities of human behavior involving people in distress.,Damián Szifron,"Darío Grandinetti, María Marull, Mónica Villa, Rita Cortese",2014,122,8.1,110100,3.08,77.0,True,0.5831323996511221
426,Ghostbusters,80,"Following a ghost invasion of Manhattan, paranormal enthusiasts Erin Gilbert and Abby Yates, nuclear engineer Jillian Holtzmann, and subway worker Patty Tolan band together to stop the otherworldly threat.",Paul Feig,"Melissa McCarthy, Kristen Wiig, Kate McKinnon, Leslie Jones",2016,116,5.3,147717,128.34,60.0,False,0.944668594935219
427,This Beautiful Fantastic,733,"A young woman who dreams of being a children's author makes an unlikely friendship with a cantankerous, rich old widower.",Simon Aboud,"Jessica Brown Findlay, Andrew Scott, Jeremy Irvine,Tom Wilkinson",2016,100,6.9,688,,51.0,True,0.8097126555615691
428,Bone Tomahawk,514,Four men set out in the Wild West to rescue a group of captives from cannibalistic cave dwellers.,S. Craig Zahler,"Kurt Russell, Patrick Wilson, Matthew Fox, Richard Jenkins",2015,132,7.1,47289,66.01,72.0,True,-0.19218388143247123
429,Youth,504,A retired orchestra conductor is on holiday with his daughter and his film director best friend in the Alps when he receives an invitation from Queen Elizabeth II to perform for Prince Philip's birthday.,Paolo Sorrentino,"Michael Caine, Harvey Keitel, Rachel Weisz, Jane Fonda",2015,124,7.3,52636,2.7,64.0,True,2.0815720805132307
430,Trance,961,An art auctioneer who has become mixed up with a group of criminals partners with a hypnotherapist in order to recover a lost painting.,Danny Boyle,"James McAvoy, Rosario Dawson, Vincent Cassel,Danny Sapani",2013,101,7.0,97141,2.32,61.0,True,-1.5126909494606895
431,Midnight Special,546,"A father and son go on the run, pursued by the government and a cult drawn to the child's special powers.",Jeff Nichols,"Michael Shannon, Joel Edgerton, Kirsten Dunst, Adam Driver",2016,112,6.7,54787,3.71,76.0,True,-1.331790054957942
432,You Don't Mess with the Zohan,838,An Israeli Special Forces Soldier fakes his death so he can re-emerge in New York City as a hair stylist.,Dennis Dugan,"Adam Sandler, John Turturro, Emmanuelle Chriqui,Nick Swardson",2008,113,5.5,163144,100.02,54.0,False,-0.08614923806083732
433,The Warriors Gate,828,A teenager is magically transported to China and learns to convert his video game skills into those of a Kung Fu warrior.,Matthias Hoene,"Mark Chao, Ni Ni, Dave Bautista, Sienna Guillory",2016,108,5.3,1391,,77.0,False,0.7800837614805248
434,The Ugly Truth,899,A romantically challenged morning show producer is reluctantly embroiled in a series of outrageous tests by her chauvinistic correspondent to prove his theories on relationships and help ... See full summary »,Robert Luketic,"Katherine Heigl, Gerard Butler, Bree Turner, Eric Winter",2009,96,6.5,172558,88.92,28.0,False,-0.0010094431081134544
435,Point Break,494,"A young FBI agent infiltrates an extraordinary team of extreme sports athletes he suspects of masterminding a string of unprecedented, sophisticated corporate heists.",Ericson Core,"Edgar Ramírez, Luke Bracey, Ray Winstone, Teresa Palmer",2015,114,5.3,44553,28.77,34.0,False,-0.046042609172746066
436,Perfetti sconosciuti,484,"Seven long-time friends get together for a dinner. When they decide to share with each other the content of every text message, email and phone call they receive, many secrets start to unveil and the equilibrium trembles.",Paolo Genovese,"Giuseppe Battiston, Anna Foglietta, Marco Giallini,Edoardo Leo",2016,97,7.7,17584,,43.0,True,1.11310265268662
437,The Whole Truth,629,A defense attorney works to get his teenage client acquitted of murdering his wealthy father.,Courtney Hunt,"Keanu Reeves, Renée Zellweger, Gugu Mbatha-Raw, Gabriel Basso",2016,93,6.1,10700,,,True,-1.0186754334111414
438,Legion,957,"When a group of strangers at a dusty roadside diner come under attack by demonic forces, their only chance for survival lies with an archangel named Michael, who informs a pregnant waitress that her unborn child is humanity's last hope.",Scott Stewart,"Paul Bettany, Dennis Quaid, Charles S. Dutton, Lucas Black",2010,100,5.2,84158,40.17,32.0,False,1.6000934960479722
439,Miracles from Heaven,981,A young girl suffering from a rare digestive disorder finds herself miraculously cured after surviving a terrible accident.,Patricia Riggen,"Jennifer Garner, Kylie Rogers, Martin Henderson,Brighton Sharbino",2016,109,7.0,12048,61.69,44.0,True,-0.06544410515026108
440,Need for Speed,536,"Fresh from prison, a street racer who was framed by a wealthy business associate joins a cross country race with revenge in mind. His ex-partner, learning of the plan, places a massive bounty on his head as the race begins.",Scott Waugh,"Aaron Paul, Dominic Cooper, Imogen Poots, Scott Mescudi",2014,132,6.5,143389,43.57,39.0,True,0.03190134107611028
441,Insurgent,355,Beatrice Prior must confront her inner demons and continue her fight against a powerful alliance which threatens to tear her society apart with the help from others on her side.,Robert Schwentke,"Shailene Woodley, Ansel Elgort, Theo James,Kate Winslet",2015,119,6.3,171970,130.0,42.0,False,1.8157324747362675
442,Red Dawn,873,A group of teenagers look to save their town from an invasion of North Korean soldiers.,Dan Bradley,"Chris Hemsworth, Isabel Lucas, Josh Hutcherson, Josh Peck",2012,93,5.4,64584,44.8,31.0,False,-1.7892074782836316
443,Nerve,128,"A high school senior finds herself immersed in an online game of truth or dare, where her every move starts to become manipulated by an anonymous community of ""watchers.""",Henry Joost,"Emma Roberts, Dave Franco, Emily Meade, Miles Heizer",2016,96,6.6,69651,38.56,58.0,False,0.03551194685006339
444,The Girl on the Train,63,A divorcee becomes entangled in a missing persons investigation that promises to send shockwaves throughout her life.,Tate Taylor,"Emily Blunt, Haley Bennett, Rebecca Ferguson, Justin Theroux",2016,112,6.5,102177,75.31,48.0,True,-1.6453288190277602
446,Movie 43,509,A series of interconnected short films follows a washed-up producer as he pitches insane story lines featuring some of the biggest stars in Hollywood.,Elizabeth Banks,"Emma Stone, Stephen Merchant, Richard Gere, Liev Schreiber",2013,94,4.3,83625,8.83,18.0,False,-0.3018703456777296
448,The Hobbit: The Battle of the Five Armies,314,Bilbo and Company are forced to engage in a war against an array of combatants and keep the Lonely Mountain from falling into the hands of a rising darkness.,Peter Jackson,"Ian McKellen, Martin Freeman, Richard Armitage,Cate Blanchett",2014,144,7.4,385598,255.11,59.0,False,-0.17655839073824364
449,The Twilight Saga: Eclipse,942,"As a string of mysterious killings grips Seattle, Bella, whose high school graduation is fast approaching, is forced to choose between her love for vampire Edward and her friendship with werewolf Jacob.",David Slade,"Kristen Stewart, Robert Pattinson, Taylor Lautner,Xavier Samuel",2010,124,4.9,192740,300.52,58.0,True,-1.2694589168935955
450,Jagten,456,"A teacher lives a lonely life, all the while struggling over his son's custody. His life slowly gets better as he finds love and receives good news from his son, but his new luck is about to be brutally shattered by an innocent little lie.",Thomas Vinterberg,"Mads Mikkelsen, Thomas Bo Larsen, Annika Wedderkopp, Lasse Fogelstrøm",2012,115,8.3,192263,0.61,76.0,True,0.2721854552262593
452,Trust,525,A teenage girl is targeted by an online sexual predator.,David Schwimmer,"Clive Owen, Catherine Keener, Liana Liberato,Jason Clarke",2010,106,7.0,36043,0.06,60.0,True,0.28356044562758054
453,American Reunion,640,"Jim, Michelle, Stifler, and their friends reunite in East Great Falls, Michigan for their high school reunion.",Jon Hurwitz,"Jason Biggs, Alyson Hannigan,Seann William Scott, Chris Klein",2012,113,6.7,178471,56.72,49.0,False,-1.0425002367106866
454,Endless Love,988,The story of a privileged girl and a charismatic boy whose instant desire sparks a love affair made only more reckless by parents trying to keep them apart.,Shana Feste,"Gabriella Wilde, Alex Pettyfer, Bruce Greenwood,Robert Patrick",2014,104,6.3,33688,23.39,30.0,True,-0.6737945387347576
456,The Lucky One,888,A Marine travels to Louisiana after serving three tours in Iraq and searches for the unknown woman he believes was his good luck charm during the war.,Scott Hicks,"Zac Efron, Taylor Schilling, Blythe Danner, Riley Thomas Stewart",2012,101,6.5,82874,60.44,39.0,True,-2.6213877542977144
457,The Theory of Everything,358,A look at the relationship between the famous physicist Stephen Hawking and his wife.,James Marsh,"Eddie Redmayne, Felicity Jones, Tom Prior, Sophie Perry",2014,123,7.7,299718,35.89,72.0,True,0.48478323864171347
458,Southpaw,382,Boxer Billy Hope turns to trainer Tick Wills to help him get his life back on track after losing his wife in a tragic accident and his daughter to child protection services.,Antoine Fuqua,"Jake Gyllenhaal, Rachel McAdams, Oona Laurence,Forest Whitaker",2015,124,7.4,169083,52.42,57.0,True,0.0032741807954748303
459,Big Hero 6,449,"The special bond that develops between plus-sized inflatable robot Baymax, and prodigy Hiro Hamada, who team up with a group of friends to form a band of high-tech heroes.",Don Hall,"Ryan Potter, Scott Adsit, Jamie Chung,T.J. Miller",2014,102,7.8,309186,222.49,74.0,False,1.3944312724600074
460,Underworld: Rise of the Lycans,991,"An origins story centered on the centuries-old feud between the race of aristocratic vampires and their onetime slaves, the Lycans.",Patrick Tatopoulos,"Rhona Mitra, Michael Sheen, Bill Nighy, Steven Mackintosh",2009,92,6.6,129708,45.8,44.0,False,-0.7939381849433349
461,A Kind of Murder,232,"In 1960s New York, Walter Stackhouse is a successful architect married to the beautiful Clara who leads a seemingly perfect life. But his fascination with an unsolved murder leads him into a spiral of chaos as he is forced to play cat-and-mouse with a clever killer and an overambitious detective, while at the same time lusting after another woman.",Andy Goddard,"Patrick Wilson, Jessica Biel, Haley Bennett, Vincent Kartheiser",2016,95,5.2,3305,0.0,50.0,True,0.27689334076391453
462,The Pursuit of Happyness,641,A struggling salesman takes custody of his son as he's poised to begin a life-changing professional career.,Gabriele Muccino,"Will Smith, Thandie Newton, Jaden Smith, Brian Howe",2006,117,8.0,361105,162.59,64.0,True,-2.3537878039523044
463,Independence Day: Resurgence,25,"Two decades after the first Independence Day invasion, Earth is faced with a new extra-Solar threat. But will mankind's new space defenses be enough?",Roland Emmerich,"Liam Hemsworth, Jeff Goldblum, Bill Pullman,Maika Monroe",2016,120,5.3,127553,103.14,32.0,False,-0.7770884458685856
464,Mission: Impossible - Ghost Protocol,434,"The IMF is shut down when it's implicated in the bombing of the Kremlin, causing Ethan Hunt and his new team to go rogue to clear their organization's name.",Brad Bird,"Tom Cruise, Jeremy Renner, Simon Pegg, Paula Patton",2011,132,7.4,382459,209.36,73.0,False,0.3725088651063724
466,How to Train Your Dragon,773,"A hapless young Viking who aspires to hunt dragons becomes the unlikely friend of a young dragon himself, and learns there may be more to the creatures than he assumed.",Dean DeBlois,"Jay Baruchel, Gerard Butler,Christopher Mintz-Plasse, Craig Ferguson",2010,98,8.1,523893,217.39,74.0,False,-0.8882615785295089
467,Pirates of the Caribbean: At World's End,76,"Captain Barbossa, Will Turner and Elizabeth Swann must sail off the edge of the map, navigate treachery and betrayal, find Jack Sparrow, and make their final alliances for one last decisive battle.",Gore Verbinski,"Johnny Depp, Orlando Bloom, Keira Knightley,Geoffrey Rush",2007,169,7.1,498821,309.4,50.0,False,-0.45483199200950164
468,Pride and Prejudice and Zombies,423,Five sisters in 19th century England must cope with the pressures to marry while protecting themselves from a growing population of zombies.,Burr Steers,"Lily James, Sam Riley, Jack Huston, Bella Heathcote",2016,108,5.8,35003,10.91,45.0,False,2.2900450627946474
469,The Autopsy of Jane Doe,62,"A father and son, both coroners, are pulled into a complex mystery while attempting to identify the body of a young woman, who was apparently harboring dark secrets.",André Øvredal,"Brian Cox, Emile Hirsch, Ophelia Lovibond, Michael McElhatton",2016,86,6.8,35870,,65.0,False,1.499461552767444
470,Annie,982,"A foster kid, who lives with her mean foster mom, sees her life change when business tycoon and New York mayoral candidate Will Stacks makes a thinly-veiled campaign move and takes her in.",Will Gluck,"Quvenzhané Wallis, Cameron Diaz, Jamie Foxx, Rose Byrne",2014,118,5.3,27312,85.91,33.0,True,-0.6010706196658461
471,Pan,566,"12-year-old orphan Peter is spirited away to the magical world of Neverland, where he finds both fun and danger, and ultimately discovers his destiny -- to become the hero who will be forever known as Peter Pan.",Joe Wright,"Levi Miller, Hugh Jackman, Garrett Hedlund, Rooney Mara",2015,111,5.8,47804,34.96,36.0,False,-0.612890347501636
473,The 5th Wave,317,"Four waves of increasingly deadly alien attacks have left most of Earth decimated. Cassie is on the run, desperately trying to save her younger brother.",J Blakeson,"Chloë Grace Moretz, Matthew Zuk, Gabriela Lopez,Bailey Anne Borders",2016,112,5.2,73093,34.91,33.0,False,-1.7853658921109716
474,The Perks of Being a Wallflower,236,An introvert freshman is taken under the wings of two seniors who welcome him to the real world.,Stephen Chbosky,"Logan Lerman, Emma Watson, Ezra Miller, Paul Rudd",2012,102,8.0,377336,17.74,67.0,True,-0.786746258657849
476,Resident Evil: Retribution,691,Alice fights alongside a resistance movement to regain her freedom from an Umbrella Corporation testing facility.,Paul W.S. Anderson,"Milla Jovovich, Sienna Guillory, Michelle Rodriguez, Aryana Engineer",2012,96,5.4,114144,42.35,39.0,False,0.500589755842433
479,Sicario,154,An idealistic FBI agent is enlisted by a government task force to aid in the escalating war against drugs at the border area between the U.S. and Mexico.,Denis Villeneuve,"Emily Blunt, Josh Brolin, Benicio Del Toro, Jon Bernthal",2015,121,7.6,243230,46.88,82.0,True,0.6909794756211189
480,Minions,401,"Minions Stuart, Kevin and Bob are recruited by Scarlet Overkill, a super-villain who, alongside her inventor husband Herb, hatches a plot to take over the world.",Kyle Balda,"Sandra Bullock, Jon Hamm, Michael Keaton, Pierre Coffin",2015,91,6.4,159830,336.03,56.0,False,0.7215521212961067
481,Black Mass,377,"The true story of Whitey Bulger, the brother of a state senator and the most infamous violent criminal in the history of South Boston, who became an FBI informant to take down a Mafia family invading his turf.",Scott Cooper,"Johnny Depp, Benedict Cumberbatch, Dakota Johnson, Joel Edgerton",2015,123,6.9,135706,62.56,68.0,True,1.4712423173433828
482,Lavender,757,"After losing her memory, a woman begins to see unexplained things after her psychiatrist suggests she visit her childhood home.",Ed Gass-Donnelly,"Abbie Cornish, Dermot Mulroney, Justin Long,Diego Klattenhoff",2016,92,5.2,2083,,46.0,True,2.06835806209775
483,Source Code,637,A soldier wakes up in someone else's body and discovers he's part of an experimental government program to find the bomber of a commuter train. A mission he has only 8 minutes to complete.,Duncan Jones,"Jake Gyllenhaal, Michelle Monaghan, Vera Farmiga,Jeffrey Wright",2011,93,7.5,404884,54.7,74.0,False,0.6817185986146106
484,The Ridiculous 6,643,"An outlaw who was raised by Native Americans discovers that he has five half-brothers; together the men go on a mission to find their wayward, deadbeat dad.",Frank Coraci,"Adam Sandler, Terry Crews, Jorge Garcia, Taylor Lautner",2015,119,4.8,31149,,18.0,False,-2.5106266492372353
486,Jurassic World,86,"A new theme park, built on the original site of Jurassic Park, creates a genetically modified hybrid dinosaur, which escapes containment and goes on a killing spree.",Colin Trevorrow,"Chris Pratt, Bryce Dallas Howard, Ty Simpkins,Judy Greer",2015,124,7.0,455169,652.18,59.0,False,-1.312176855636474
487,The Danish Girl,284,A fictitious love story loosely inspired by the lives of Danish artists Lili Elbe and Gerda Wegener. Lili and Gerda's marriage and work evolve as they navigate Lili's groundbreaking journey as a transgender pioneer.,Tom Hooper,"Eddie Redmayne, Alicia Vikander, Amber Heard, Ben Whishaw",2015,119,7.0,110773,12.71,66.0,True,-0.39789046934299965
489,Oblivion,276,A veteran assigned to extract Earth's remaining resources begins to question what he knows about his mission and himself.,Joseph Kosinski,"Tom Cruise, Morgan Freeman, Andrea Riseborough, Olga Kurylenko",2013,124,7.0,410125,89.02,54.0,False,-0.6592494477011643
490,The Man Who Knew Infinity,780,"The story of the life and academic career of the pioneer Indian mathematician, Srinivasa Ramanujan, and his friendship with his mentor, Professor G.H. Hardy.",Matt Brown,"Dev Patel, Jeremy Irons, Malcolm Sinclair, Raghuvir Joshi",2015,108,7.2,29912,3.86,,True,-0.5805218330866107
491,The Golden Compass,920,"In a parallel universe, young Lyra Belacqua journeys to the far North to save her best friend and other kidnapped children from terrible experiments by a mysterious organization.",Chris Weitz,"Nicole Kidman, Daniel Craig, Dakota Blue Richards, Ben Walker",2007,113,6.1,155078,70.08,51.0,False,1.8557794360368618
492,Popstar: Never Stop Never Stopping,654,"When it becomes clear that his solo album is a failure, a former boy band member does everything in his power to maintain his celebrity status.",Akiva Schaffer,"Andy Samberg, Jorma Taccone,Akiva Schaffer, Sarah Silverman",2016,87,6.7,30875,9.39,68.0,False,1.2983552832055025
493,RocknRolla,323,"In London, a real-estate scam puts millions of pounds up for grabs, attracting some of the city's scrappiest tough guys and its more established underworld types, all of whom are looking to get rich quick. While the city's seasoned criminals vie for the cash, an unexpected player -- a drugged-out rock 'n' roller presumed to be dead but very much alive -- has a multi-million-dollar prize fall into... See full summary »",Guy Ritchie,"Gerard Butler, Tom Wilkinson, Idris Elba, Thandie Newton",2008,114,7.3,203096,5.69,53.0,False,-2.3458974811988793
494,Hounds of Love,23,"A cold-blooded predatory couple while cruising the streets in search of their next victim, will stumble upon a 17-year-old high school girl, who will be sedated, abducted and chained in the strangers' guest room.",Ben Young,"Emma Booth, Ashleigh Cummings, Stephen Curry,Susie Porter",2016,108,6.7,1115,,72.0,True,-0.5365556105441706
495,The Lobster,227,"In a dystopian near future, single people, according to the laws of The City, are taken to The Hotel, where they are obliged to find a romantic partner in forty-five days or are transformed into beasts and sent off into The Woods.",Yorgos Lanthimos,"Colin Farrell, Rachel Weisz, Jessica Barden,Olivia Colman",2015,119,7.1,121313,8.7,82.0,True,0.6599165338960544
497,Collide,376,"An American backpacker gets involved with a ring of drug smugglers as their driver, though he winds up on the run from his employers across Cologne high-speed Autobahn.",Eran Creevy,"Nicholas Hoult, Felicity Jones, Anthony Hopkins, Ben Kingsley",2016,99,5.7,7583,2.2,33.0,False,0.08281148361165151
498,Notorious,915,"The life and death story of Notorious B.I.G. (a.k.a. Christopher Wallace), who came straight out of Brooklyn to take the world of rap music by storm.",George Tillman Jr.,"Jamal Woolard, Anthony Mackie, Derek Luke,Momo Dione",2009,122,6.7,33007,36.84,60.0,True,1.2260214724988399
500,Cinderella,183,"When her father unexpectedly passes away, young Ella finds herself at the mercy of her cruel stepmother and her scheming step-sisters. Never one to give up hope, Ella's fortunes begin to change after meeting a dashing stranger.",Kenneth Branagh,"Lily James, Cate Blanchett, Richard Madden,Helena Bonham Carter",2015,105,7.0,117018,201.15,67.0,True,-1.5973612191054185
