,Title,Rank,Description,Director,Actors,Year,Runtime (Minutes),Rating,Votes,Revenue (Millions),Metascore,Genre_is_Drama,split
207,Transformers: Age of Extinction,127,"Autobots must escape sight from a bounty hunter who has taken control of the human serendipity: Unexpectedly, Optimus Prime and his remaining gang turn to a mechanic, his daughter, and her back street racing boyfriend for help.",Michael Bay,"Mark Wahlberg, Nicola Peltz, Jack Reynor, Stanley Tucci",2014,165,5.7,255483,245.43,32.0,False,1.7433620377224628
209,The Book of Life,713,"Manolo, a young man who is torn between fulfilling the expectations of his family and following his heart, embarks on an adventure that spans three fantastic worlds where he must face his greatest fears.",Jorge R. Gutiérrez,"Diego Luna, Zoe Saldana, Channing Tatum, Ron Perlman",2014,95,7.3,50388,50.15,67.0,False,0.4632266716037464
210,The Fountain,775,"As a modern-day scientist, Tommy is struggling with mortality, desperately searching for the medical breakthrough that will save the life of his cancer-stricken wife, Izzi.",Darren Aronofsky,"Hugh Jackman, Rachel Weisz, Sean Patrick Thomas, Ellen Burstyn",2006,96,7.3,199193,10.14,51.0,True,0.5918579769964687
211,Rogue One,13,"The Rebel Alliance makes a risky move to steal the plans for the Death Star, setting up the epic saga to follow.",Gareth Edwards,"Felicity Jones, Diego Luna, Alan Tudyk, Donnie Yen",2016,133,7.9,323118,532.17,65.0,False,1.579416688779759
212,Miss Peregrine's Home for Peculiar Children,121,"When Jacob discovers clues to a mystery that stretches across time, he finds Miss Peregrine's Home for Peculiar Children. But the danger deepens after he gets to know the residents and learns about their special powers.",Tim Burton,"Eva Green, Asa Butterfield, Samuel L. Jackson, Judi Dench",2016,127,6.7,101058,87.24,57.0,True,-0.852375346585427
213,Denial,463,"Acclaimed writer and historian Deborah E. Lipstadt must battle for historical truth to prove the Holocaust actually occurred when David Irving, a renowned denier, sues her for libel.",Mick Jackson,"Rachel Weisz, Tom Wilkinson, Timothy Spall, Andrew Scott",2016,109,6.6,8229,4.07,63.0,True,-0.1675255662263093
214,The Comedian,107,A look at the life of an aging insult comic named Jack Burke.,Taylor Hackford,"Robert De Niro, Leslie Mann, Danny DeVito, Edie Falco",2016,120,5.4,1954,1.66,40.0,False,-0.23563714180984513
215,Beyond the Gates,173,Two estranged brothers reunite at their missing father's video store and find a VCR board game dubbed 'Beyond The Gates' that holds a connection to their father's disappearance.,Jackson Stewart,"Graham Skipper, Chase Williamson, Brea Grant,Barbara Crampton",2016,84,5.2,2127,,59.0,False,-0.3615471745030905
216,Jackie,237,"Following the assassination of President John F. Kennedy, First Lady Jacqueline Kennedy fights through grief and trauma to regain her faith, console her children, and define her husband's historic legacy.",Pablo Larraín,"Natalie Portman, Peter Sarsgaard, Greta Gerwig,Billy Crudup",2016,100,6.8,41446,13.96,81.0,True,0.6587805836403979
219,Alice Through the Looking Glass,307,Alice returns to the whimsical world of Wonderland and travels back in time to help the Mad Hatter.,James Bobin,"Mia Wasikowska, Johnny Depp, Helena Bonham Carter, Anne Hathaway",2016,113,6.2,57207,77.04,34.0,False,-0.007107430223917588
221,The Fault in Our Stars,339,Two teenage cancer patients begin a life-affirming journey to visit a reclusive author in Amsterdam.,Josh Boone,"Shailene Woodley, Ansel Elgort, Nat Wolff, Laura Dern",2014,126,7.8,271301,124.87,69.0,True,-1.1043637758139566
222,Scouts Guide to the Zombie Apocalypse,922,"Three scouts, on the eve of their last camp-out, discover the true meaning of friendship when they attempt to save their town from a zombie outbreak.",Christopher Landon,"Tye Sheridan, Logan Miller, Joey Morgan,Sarah Dumont",2015,93,6.3,31651,3.64,32.0,False,0.4642570938806554
223,Oculus,752,"A woman tries to exonerate her brother, who was convicted of murder, by proving that the crime was committed by a supernatural phenomenon.",Mike Flanagan,"Karen Gillan, Brenton Thwaites, Katee Sackhoff,Rory Cochrane",2013,104,6.5,92875,27.69,61.0,False,0.2869718571752212
225,Antichrist,623,"A grieving couple retreat to their cabin in the woods, hoping to repair their broken hearts and troubled marriage. But nature takes its course and things go from bad to worse.",Lars von Trier,"Willem Dafoe, Charlotte Gainsbourg, Storm Acheche Sahlstrøm",2009,108,6.6,94069,0.4,49.0,True,0.09944162610433181
226,Mission: Impossible III,870,Agent Ethan Hunt comes into conflict with a dangerous and sadistic arms dealer who threatens his life and his fianceé in response .,J.J. Abrams,"Tom Cruise, Michelle Monaghan, Ving Rhames, Philip Seymour Hoffman",2006,126,6.9,270429,133.38,66.0,False,-0.6068345013740984
227,Locke,864,"Ivan Locke, a dedicated family man and successful construction manager, receives a phone call on the eve of the biggest challenge of his career that sets in motion a series of events that threaten his carefully cultivated existence.",Steven Knight,"Tom Hardy, Olivia Colman, Ruth Wilson, Andrew Scott",2013,85,7.1,100890,1.36,81.0,True,0.21802833858523402
228,Hugo,736,"In Paris in 1931, an orphan named Hugo Cabret who lives in the walls of a train station is wrapped up in a mystery involving his late father and an automaton.",Martin Scorsese,"Asa Butterfield, Chloë Grace Moretz, Christopher Lee, Ben Kingsley",2011,126,7.5,259182,73.82,83.0,True,-0.9764639798302054
229,Sex Tape,583,"A married couple wake up to discover that the sex tape they made the evening before has gone missing, leading to a frantic search for its whereabouts.",Jake Kasdan,"Jason Segel, Cameron Diaz, Rob Corddry, Ellie Kemper",2014,94,5.1,89885,38.54,36.0,False,-0.6398442721860139
230,To Rome with Love,814,"The lives of some visitors and residents of Rome and the romances, adventures and predicaments they get into.",Woody Allen,"Woody Allen, Penélope Cruz, Jesse Eisenberg, Ellen Page",2012,112,6.3,72050,16.68,54.0,False,1.4428414331996628
231,The Gift,557,A young married couple's lives are thrown into a harrowing tailspin when an acquaintance from the husband's past brings mysterious gifts and a horrifying secret to light after more than 20 years.,Joel Edgerton,"Jason Bateman, Rebecca Hall, Joel Edgerton, Allison Tolman",2015,108,7.1,96688,43.77,77.0,False,-0.0482402899758231
232,Kicks,950,"Brandon is a 15 year old whose dream is a pair of fresh Air Jordans. Soon after he gets his hands on them, they're stolen by a local hood, causing Brandon and his two friends to go on a dangerous mission through Oakland to retrieve them.",Justin Tipping,"Jahking Guillory, Christopher Jordan Wallace,Christopher Meyer, Kofi Siriboe",2016,80,6.1,2417,0.15,69.0,False,-0.39294417604889953
233,Mindhorn,8,"A has-been actor best known for playing the title character in the 1980s detective series ""Mindhorn"" must work with the police when a serial killer says that he will only speak with Detective Mindhorn, whom he believes to be a real person.",Sean Foley,"Essie Davis, Andrea Riseborough, Julian Barratt,Kenneth Branagh",2016,89,6.4,2490,,71.0,False,0.8058263811738176
234,Gran Torino,646,"Disgruntled Korean War veteran Walt Kowalski sets out to reform his neighbor, a Hmong teenager who tried to steal Kowalski's prized possession: a 1972 Gran Torino.",Clint Eastwood,"Clint Eastwood, Bee Vang, Christopher Carley,Ahney Her",2008,116,8.2,595779,148.09,,True,0.4650828221981361
235,Kynodontas,252,"Three teenagers live isolated, without leaving their house, because their over-protective parents say they can only leave when their dogtooth falls out.",Yorgos Lanthimos,"Christos Stergioglou, Michele Valley, Angeliki Papoulia, Hristos Passalis",2009,94,7.3,50946,0.11,73.0,True,1.418806385083786
236,Flight,846,"An airline pilot saves almost all his passengers on his malfunctioning airliner which eventually crashed, but an investigation into the accident reveals something troubling.",Robert Zemeckis,"Denzel Washington, Nadine Velazquez, Don Cheadle, John Goodman",2012,138,7.3,276347,93.75,76.0,True,1.1649958609810998
237,The Gunman,392,"A sniper on a mercenary assassination team, kills the minister of mines of the Congo. Terrier's successful kill shot forces him into hiding. Returning to the Congo years later, he becomes the target of a hit squad himself.",Pierre Morel,"Sean Penn, Idris Elba, Jasmine Trinca, Javier Bardem",2015,115,5.8,31194,10.64,39.0,True,1.0931761130885145
238,Goosebumps,465,"A teenager teams up with the daughter of young adult horror author R. L. Stine after the writer's imaginary demons are set free on the town of Madison, Delaware.",Rob Letterman,"Jack Black, Dylan Minnette, Odeya Rush, Ryan Lee",2015,103,6.3,57602,80.02,60.0,False,-1.080660865428251
239,Prisoners,91,"When Keller Dover's daughter and her friend go missing, he takes matters into his own hands as the police pursue multiple leads and the pressure mounts.",Denis Villeneuve,"Hugh Jackman, Jake Gyllenhaal, Viola Davis,Melissa Leo",2013,153,8.1,431185,60.96,74.0,True,0.4435173093000498
240,Project X,995,"3 high school seniors throw a birthday party to make a name for themselves. As the night progresses, things spiral out of control as word of the party spreads.",Nima Nourizadeh,"Thomas Mann, Oliver Cooper, Jonathan Daniel Brown, Dax Flame",2012,88,6.7,164088,54.72,48.0,False,0.4556996262990872
241,The Nice Guys,96,"In 1970s Los Angeles, a mismatched pair of private eyes investigate a missing girl and the mysterious death of a porn star.",Shane Black,"Russell Crowe, Ryan Gosling, Angourie Rice, Matt Bomer",2016,116,7.4,175067,36.25,70.0,False,-0.10118102137014276
242,P.S. I Love You,544,A young widow discovers that her late husband has left her 10 messages intended to help ease her pain and start a new life.,Richard LaGravenese,"Hilary Swank, Gerard Butler, Harry Connick Jr., Lisa Kudrow",2007,126,7.1,177247,53.68,,True,0.7814735897410942
243,I Spit on Your Grave,964,"A writer who is brutalized during her cabin retreat seeks revenge on her attackers, who left her for dead.",Steven R. Monroe,"Sarah Butler, Jeff Branson, Andrew Howard,Daniel Franzese",2010,108,6.3,60133,0.09,27.0,False,0.25393477242451573
246,After Earth,949,"A crash landing leaves Kitai Raige and his father Cypher stranded on Earth, a millennium after events forced humanity's escape. With Cypher injured, Kitai must embark on a perilous journey to signal for help.",M. Night Shyamalan,"Jaden Smith, David Denman, Will Smith,Sophie Okonedo",2013,100,4.9,166512,60.52,33.0,False,0.4442504589574289
247,Paris pieds nus,26,"Fiona visits Paris for the first time to assist her myopic Aunt Martha. Catastrophes ensue, mainly involving Dom, a homeless man who has yet to have an emotion or thought he was afraid of expressing.",Dominique Abel,"Fiona Gordon, Dominique Abel,Emmanuelle Riva, Pierre Richard",2016,83,6.8,222,,,False,-0.5937433159921612
248,Horns,866,"In the aftermath of his girlfriend's mysterious death, a young man awakens to find strange horns sprouting from his temples.",Alexandre Aja,"Daniel Radcliffe, Juno Temple, Max Minghella, Joe Anderson",2013,120,6.5,61060,0.16,46.0,True,-1.4470233528670342
250,Bahubali: The Beginning,27,"In ancient India, an adventurous and daring man becomes involved in a decades old feud between two warring people.",S.S. Rajamouli,"Prabhas, Rana Daggubati, Anushka Shetty,Tamannaah Bhatia",2015,159,8.3,76193,6.5,,True,0.08941812035785632
252,Rock Dog,243,"When a radio falls from the sky into the hands of a wide-eyed Tibetan Mastiff, he leaves home to fulfill his dream of becoming a musician, setting into motion a series of completely unexpected events.",Ash Brannon,"Luke Wilson, Eddie Izzard, J.K. Simmons, Lewis Black",2016,90,5.8,1109,9.4,48.0,False,0.4642543666152852
253,Män som hatar kvinnor,591,A journalist is aided in his search for a woman who has been missing -- or dead -- for forty years by a young female hacker.,Niels Arden Oplev,"Michael Nyqvist, Noomi Rapace, Ewa Fröling,Lena Endre",2009,152,7.8,182074,10.1,76.0,True,0.9676656109613181
254,Mother's Day,53,Three generations come together in the week leading up to Mother's Day.,Garry Marshall,"Jennifer Aniston, Kate Hudson, Julia Roberts, Jason Sudeikis",2016,118,5.6,20221,32.46,18.0,True,-1.553807708135119
255,Tusk,416,"When podcaster Wallace Bryton goes missing in the backwoods of Manitoba while interviewing a mysterious seafarer named Howard Howe, his best friend Teddy and girlfriend Allison team with an ex-cop to look for him.",Kevin Smith,"Justin Long, Michael Parks, Haley Joel Osment,Genesis Rodriguez",2014,102,5.4,34546,1.82,55.0,True,0.7266724103547915
256,Love,186,"Murphy is an American living in Paris who enters a highly sexually and emotionally charged relationship with the unstable Electra. Unaware of the effect it will have on their relationship, they invite their pretty neighbor into their bed.",Gaspar Noé,"Aomi Muyock, Karl Glusman, Klara Kristin, Juan Saavedra",2015,135,6.0,24003,,51.0,True,-0.28351961892545335
257,A Million Ways to Die in the West,746,"As a cowardly farmer begins to fall for the mysterious new woman in town, he must put his new-found courage to the test when her husband, a notorious gun-slinger, announces his arrival.",Seth MacFarlane,"Seth MacFarlane, Charlize Theron, Liam Neeson,Amanda Seyfried",2014,116,6.1,144779,42.62,44.0,False,0.2917983146996911
258,Robin Hood,388,"In 12th century England, Robin and his band of marauders confront corruption in a local village and lead an uprising against the crown that will forever alter the balance of world power.",Ridley Scott,"Russell Crowe, Cate Blanchett, Matthew Macfadyen,Max von Sydow",2010,140,6.7,221117,105.22,53.0,True,-2.0502244603499244
259,Across the Universe,983,The music of the Beatles and the Vietnam War form the backdrop for the romance between an upper-class American girl and a poor Liverpudlian artist.,Julie Taymor,"Evan Rachel Wood, Jim Sturgess, Joe Anderson, Dana Fuchs",2007,133,7.4,95172,24.34,56.0,True,1.6415607434041766
261,The Babadook,313,"A single mother, plagued by the violent death of her husband, battles with her son's fear of a monster lurking in the house, but soon discovers a sinister presence all around her.",Jennifer Kent,"Essie Davis, Noah Wiseman, Daniel Henshall, Hayley McElhinney",2014,93,6.8,132580,0.92,86.0,True,-0.6679259967251916
262,A Quiet Passion,535,"The story of American poet Emily Dickinson from her early days as a young schoolgirl to her later years as a reclusive, unrecognized artist.",Terence Davies,"Cynthia Nixon, Jennifer Ehle, Duncan Duff, Keith Carradine",2016,125,7.2,1024,1.08,77.0,True,0.7192882107321509
264,13 Hours,169,"During an attack on a U.S. compound in Libya, a security team struggles to make sense out of the chaos.",Michael Bay,"John Krasinski, Pablo Schreiber, James Badge Dale,David Denman",2016,144,7.3,76935,52.82,48.0,True,-1.0180019487266707
265,The Spectacular Now,808,"A hard-partying high school senior's philosophy on life changes when he meets the not-so-typical ""nice girl.""",James Ponsoldt,"Miles Teller, Shailene Woodley, Kyle Chandler,Jennifer Jason Leigh",2013,95,7.1,115751,6.85,82.0,True,1.0354351895825888
266,12 Years a Slave,112,"In the antebellum United States, Solomon Northup, a free black man from upstate New York, is abducted and sold into slavery.",Steve McQueen,"Chiwetel Ejiofor, Michael Kenneth Williams, Michael Fassbender, Brad Pitt",2013,134,8.1,486338,56.67,96.0,True,-0.9624913931190897
268,Saving Mr. Banks,882,"Author P.L. Travers reflects on her childhood after reluctantly meeting with Walt Disney, who seeks to adapt her Mary Poppins books for the big screen.",John Lee Hancock,"Emma Thompson, Tom Hanks, Annie Rose Buckley, Colin Farrell",2013,125,7.5,125693,83.3,65.0,True,-0.17789531068200928
269,The Intouchables,250,"After he becomes a quadriplegic from a paragliding accident, an aristocrat hires a young man from the projects to be his caregiver.",Olivier Nakache,"François Cluzet, Omar Sy, Anne Le Ny, Audrey Fleurot",2011,112,8.6,557965,13.18,57.0,True,-1.4457931246869442
270,Harry Potter and the Order of the Phoenix,315,"With their warning about Lord Voldemort's return scoffed at, Harry and Dumbledore are targeted by the Wizard authorities as an authoritarian bureaucrat slowly seizes power at Hogwarts.",David Yates,"Daniel Radcliffe, Emma Watson, Rupert Grint, Brendan Gleeson",2007,138,7.5,385325,292.0,71.0,False,0.16472307692831512
271,The Hills Have Eyes,859,"A suburban American family is being stalked by a group of psychotic people who live in the desert, far away from civilization.",Alexandre Aja,"Ted Levine, Kathleen Quinlan, Dan Byrd, Emilie de Ravin",2006,107,6.4,136642,41.78,52.0,False,-1.193434397703427
272,Closed Circuit,710,A high-profile terrorism case unexpectedly binds together two ex-lovers on the defense team - testing the limits of their loyalties and placing their lives in jeopardy.,John Crowley,"Eric Bana, Rebecca Hall, Jim Broadbent, Ciarán Hinds",2013,96,6.2,18437,5.73,50.0,True,-2.2901307287463566
275,The Magnificent Seven,39,Seven gunmen in the old west gradually come together to help a poor village against savage thieves.,Antoine Fuqua,"Denzel Washington, Chris Pratt, Ethan Hawke,Vincent D'Onofrio",2016,132,6.9,122853,93.38,54.0,False,0.30730086878215845
276,Filth,436,"A corrupt, junkie cop with bipolar disorder attempts to manipulate his way through a promotion in order to win back his wife and daughter while also fighting his own borderline-fueled inner demons.",Jon S. Baird,"James McAvoy, Jamie Bell, Eddie Marsan, Imogen Poots",2013,97,7.1,81301,0.03,,True,-1.0252655315210568
277,Jane Eyre,833,A mousy governess who softens the heart of her employer soon discovers that he's hiding a terrible secret.,Cary Joji Fukunaga,"Mia Wasikowska, Michael Fassbender, Jamie Bell, Su Elliot",2011,120,7.4,67464,11.23,76.0,True,-0.06563697367532584
278,Inside Out,242,"After young Riley is uprooted from her Midwest life and moved to San Francisco, her emotions - Joy, Fear, Anger, Disgust and Sadness - conflict on how best to navigate a new city, house, and school.",Pete Docter,"Amy Poehler, Bill Hader, Lewis Black, Mindy Kaling",2015,95,8.2,416689,356.45,94.0,False,0.33705240202952336
280,Enemy,468,A man seeks out his exact look-alike after spotting him in a movie.,Denis Villeneuve,"Jake Gyllenhaal, Mélanie Laurent, Sarah Gadon,Isabella Rossellini",2013,91,6.9,111558,1.01,61.0,False,1.4698160702655698
282,Storks,331,"Storks have moved on from delivering babies to packages. But when an order for a baby appears, the best delivery stork must scramble to fix the error by delivering the baby.",Nicholas Stoller,"Andy Samberg, Katie Crown,Kelsey Grammer, Jennifer Aniston",2016,87,6.9,34248,72.66,56.0,False,-1.6723117616345755
283,Casino Royale,165,"Armed with a licence to kill, Secret Agent James Bond sets out on his first mission as 007 and must defeat a weapons dealer in a high stakes game of poker at Casino Royale, but things are not what they seem.",Martin Campbell,"Daniel Craig, Eva Green, Judi Dench, Jeffrey Wright",2006,144,8.0,495106,167.01,80.0,False,0.23300347337002575
284,The King's Speech,686,"The story of King George VI of the United Kingdom of Great Britain and Northern Ireland, his impromptu ascension to the throne and the speech therapist who helped the unsure monarch become worthy of it.",Tom Hooper,"Colin Firth, Geoffrey Rush, Helena Bonham Carter,Derek Jacobi",2010,118,8.0,534388,138.8,88.0,True,-0.9488610877591067
286,Rambo,895,"In Thailand, John Rambo joins a group of missionaries to venture into war-torn Burma, and rescue a group of Christian aid workers who were kidnapped by the ruthless local infantry unit.",Sylvester Stallone,"Sylvester Stallone, Julie Benz, Matthew Marsden, Graham McTavish",2008,92,7.1,187077,42.72,46.0,False,0.7037393829857599
287,Footloose,931,"City teenager Ren MacCormack moves to a small town where rock music and dancing have been banned, and his rebellious spirit shakes up the populace.",Craig Brewer,"Kenny Wormald, Julianne Hough, Dennis Quaid,Andie MacDowell",2011,113,5.9,39380,51.78,58.0,True,1.373805431472534
288,Tron,578,The son of a virtual world designer goes looking for his father and ends up inside the digital world that his father designed. He meets his father's corrupted creation and a unique ally who was born inside the digital world.,Joseph Kosinski,"Jeff Bridges, Garrett Hedlund, Olivia Wilde, Bruce Boxleitner",2010,125,6.8,273959,172.05,49.0,False,-1.5615532452313028
289,Folk Hero & Funny Guy,440,A successful singer-songwriter hatches a plan to help his friend's struggling comedy career and broken love life by hiring him as his opening act on his solo tour.,Jeff Grace,"Alex Karpovsky, Wyatt Russell, Meredith Hagner,Melanie Lynskey",2016,88,5.6,220,,63.0,False,0.04585930788420026
290,Victor Frankenstein,327,"Told from Igor's perspective, we see the troubled young assistant's dark origins, his redemptive friendship with the young medical student Viktor Von Frankenstein, and become eyewitnesses to the emergence of how Frankenstein became the man - and the legend - we know today.",Paul McGuigan,"Daniel Radcliffe, James McAvoy, Jessica Brown Findlay, Andrew Scott",2015,110,6.0,37975,5.77,36.0,True,-0.5064850361799261
291,The Proposal,457,A pushy boss forces her young assistant to marry her in order to keep her visa status in the U.S. and avoid deportation to Canada.,Anne Fletcher,"Sandra Bullock, Ryan Reynolds, Mary Steenburgen,Craig T. Nelson",2009,108,6.7,241709,163.95,48.0,True,-0.6321991276761486
292,Gods of Egypt,216,"Mortal hero Bek teams with the god Horus in an alliance against Set, the merciless god of darkness, who has usurped Egypt's throne, plunging the once peaceful and prosperous empire into chaos and conflict.",Alex Proyas,"Brenton Thwaites, Nikolaj Coster-Waldau, Gerard Butler, Chadwick Boseman",2016,126,5.5,73568,31.14,25.0,False,2.6675587568195813
293,The Bad Batch,113,A dystopian love story in a Texas wasteland and set in a community of cannibals.,Ana Lily Amirpour,"Keanu Reeves, Jason Momoa, Jim Carrey, Diego Luna",2016,118,6.1,512,,65.0,False,-0.02887845471636966
294,The Legend of Tarzan,108,"Tarzan, having acclimated to life in London, is called back to his former home in the jungle to investigate the activities at a mining encampment.",David Yates,"Alexander Skarsgård, Rory J. Saper, Christian Stevens, Christoph Waltz",2016,110,6.3,117590,126.59,44.0,True,0.39369554702462806
295,Star Wars: Episode VII - The Force Awakens,51,"Three decades after the defeat of the Galactic Empire, a new threat arises. The First Order attempts to rule the galaxy and only a ragtag group of heroes can stop them, along with the help of the Resistance.",J.J. Abrams,"Daisy Ridley, John Boyega, Oscar Isaac, Domhnall Gleeson",2015,136,8.1,661608,936.63,81.0,False,0.39877844332671897
296,Lincoln,334,"As the War continues to rage, America's president struggles with continuing carnage on the battlefield as he fights with many inside his own cabinet on the decision to emancipate the slaves.",Steven Spielberg,"Daniel Day-Lewis, Sally Field, David Strathairn,Joseph Gordon-Levitt",2012,150,7.4,207497,182.2,86.0,True,-0.21819090577133873
297,Imperium,503,"A young FBI agent, eager to prove himself in the field, goes undercover as a white supremacist.",Daniel Ragussis,"Daniel Radcliffe, Toni Collette, Tracy Letts, Sam Trammell",2016,109,6.5,27428,,68.0,True,-1.8480119202512677
298,Final Girl,778,A man teaches a young woman how to become a complete weapon. Later she is approached by a group of sadistic teens who kill blonde women for unknown reasons. The hunting season begins.,Tyler Shields,"Abigail Breslin, Wes Bentley, Logan Huffman,Alexander Ludwig",2015,90,4.7,9026,,56.0,False,-0.37071855696855777
299,Contagion,910,"Healthcare professionals, government officials and everyday people find themselves in the midst of a worldwide epidemic as the CDC works to find a cure.",Steven Soderbergh,"Matt Damon, Kate Winslet, Jude Law, Gwyneth Paltrow",2011,106,6.6,187004,75.64,70.0,True,1.5501586404252397
300,Lights Out,259,"Rebecca must unlock the terror behind her little brother's experiences that once tested her sanity, bringing her face to face with an entity attached to their mother.",David F. Sandberg,"Teresa Palmer, Gabriel Bateman, Maria Bello,Billy Burke",2016,81,6.4,69823,67.24,58.0,False,0.0977632280277218
301,Tomorrowland,176,"Bound by a shared destiny, a teen bursting with scientific curiosity and a former boy-genius inventor embark on a mission to unearth the secrets of a place somewhere in time and space that exists in their collective memory.",Brad Bird,"George Clooney, Britt Robertson, Hugh Laurie, Raffey Cassidy",2015,130,6.5,143069,93.42,60.0,False,-1.1679398092793616
302,Disaster Movie,830,"Over the course of one evening, an unsuspecting group of twenty-somethings find themselves bombarded by a series of natural disasters and catastrophic events.",Jason Friedberg,"Carmen Electra, Vanessa Lachey,Nicole Parker, Matt Lanter",2008,87,1.9,77207,14.17,15.0,False,0.08390738526728637
303,Tinker Tailor Soldier Spy,690,"In the bleak days of the Cold War, espionage veteran George Smiley is forced from semi-retirement to uncover a Soviet agent within MI6.",Tomas Alfredson,"Gary Oldman, Colin Firth, Tom Hardy, Mark Strong",2011,122,7.1,157053,24.1,85.0,True,1.5253589418274451
305,The Rise of the Krays,605,Two brothers unleash a psychotic reign of terror on their journey to build an empire of unprecedented power in the British Mafia.,Zackary Adler,"Matt Vael, Simon Cotton, Kevin Leslie, Olivia Moyles",2015,110,5.1,1630,6.53,90.0,True,-0.6916512467511473
